id,Name,title,price,link_item,discount,sold,evaluate,location,timestamp,discount_value,final_price
687,Quần Jean Nam DSQ,Quần Jean Nam DSQ Màu Xanh Vảy Sơn Khóa Sườn Hottrend Quần Bò Nam Thời Trang Chất Liệu DeHim Co Giãn Xưởng May Zenko MQK 017,49000,https://www.lazada.vn/products/quan-jean-nam-dsq-mau-xanh-vay-son-khoa-suon-hottrend-quan-bo-nam-thoi-trang-chat-lieu-dehim-co-gian-xuong-may-zenko-mqk-017-i2510697807.html,0.5,139,119,China,2024-07-23 13:42:02.199729,24500.0,24500.0
688,Quần jean nam cào,"Quần jean nam cào rách, Quần ống rộng dáng suông by Zenko MQK 014",49000,https://www.lazada.vn/products/quan-jean-nam-cao-rach-quan-ong-rong-dang-suong-by-zenko-mqk-014-i2510690850.html,0.5,13,4,Hồ Chí Minh,2024-07-23 13:42:02.199729,24500.0,24500.0
689,Quần jean nam retro,"Quần jean nam retro baggy CẠP CAO ống suông rộng, quần bò nam đen loang chất jeans cao cấp top xu hướng 2024 Soyoung MQK 019",49000,https://www.lazada.vn/products/quan-jean-nam-retro-baggy-cap-cao-ong-suong-rong-quan-bo-nam-den-loang-chat-jeans-cao-cap-top-xu-huong-2024-soyoung-mqk-019-i2510643746.html,0.5,194,116,,2024-07-23 13:42:02.199729,24500.0,24500.0
690,Quần JEANS 4 Vạch,Quần JEANS 4 Vạch Trắng Nam Quần bò nam Thom 4 sọc Trơn Phối Dập Kẻ Trắng Đùi Cực Đẹp Glamour MQK 018,49000,https://www.lazada.vn/products/quan-jeans-4-vach-trang-nam-quan-bo-nam-thom-4-soc-tron-phoi-dap-ke-trang-dui-cuc-dep-glamour-mqk-018-i2510642779.html,0.5,48,22,,2024-07-23 13:42:02.199729,24500.0,24500.0
691,Quần jean nam cào,"Quần jean nam cào rách, Quần ống rộng dáng suông by Xưởng May Zenko MQK 014",49000,https://www.lazada.vn/products/quan-jean-nam-cao-rach-quan-ong-rong-dang-suong-by-xuong-may-zenko-mqk-014-i2510762377.html,0.5,20,1,China,2024-07-23 13:42:02.199729,24500.0,24500.0
692,Quần JEANS 4 Vạch,Quần JEANS 4 Vạch Trắng Nam Quần bò nam Thom 4 sọc Trơn Phối Dập Kẻ Trắng Đùi Cực Đẹp Soyoung MQK 018,49000,https://www.lazada.vn/products/quan-jeans-4-vach-trang-nam-quan-bo-nam-thom-4-soc-tron-phoi-dap-ke-trang-dui-cuc-dep-soyoung-mqk-018-i2510705357.html,0.5,32,12,,2024-07-23 13:42:02.199729,24500.0,24500.0
693,Quần jean nam cào,"Quần jean nam cào rách, Quần ống rộng dáng suông by Zenkonam MQK 014",49000,https://www.lazada.vn/products/quan-jean-nam-cao-rach-quan-ong-rong-dang-suong-by-zenkonam-mqk-014-i2510782285.html,0.5,11,9,,2024-07-23 13:42:02.199729,24500.0,24500.0
694,Quần JEANS 4 Vạch,Quần JEANS 4 Vạch Trắng Nam Quần bò nam Thom 4 sọc Trơn Phối Dập Kẻ Trắng Đùi Cực Đẹp Zenko MQK 018,49000,https://www.lazada.vn/products/quan-jeans-4-vach-trang-nam-quan-bo-nam-thom-4-soc-tron-phoi-dap-ke-trang-dui-cuc-dep-zenko-mqk-018-i2510784284.html,0.5,215,131,,2024-07-23 13:42:02.199729,24500.0,24500.0
695,[ Deal Độc Quyền,[ Deal Độc Quyền ] Quần Jean ống suông dáng ôm vừa chất liệu Jean dày dặn Mway QUAN BO DAI 003,49000,https://www.lazada.vn/products/deal-doc-quyen-quan-jean-ong-suong-dang-om-vua-chat-lieu-jean-day-dan-mway-quan-bo-dai-003-i2032343185.html,0.5,395,263,Đà Nẵng,2024-07-23 13:42:02.199729,24500.0,24500.0
696,Quần jean nam ống,Quần jean nam ống rộng màu bạc rêu rách thời trang-2024 - quần bò nam form chuẩn Mway MQK 013,49000,https://www.lazada.vn/products/quan-jean-nam-ong-rong-mau-bac-reu-rach-thoi-trang-2024-quan-bo-nam-form-chuan-mway-mqk-013-i2510791292.html,0.5,166,102,,2024-07-23 13:42:02.199729,24500.0,24500.0
697,Quần jean nam ống,Quần jean nam ống rộng màu bạc rêu rách thời trang-2024 - quần bò nam form chuẩn Shiny MQK 013,49000,https://www.lazada.vn/products/quan-jean-nam-ong-rong-mau-bac-reu-rach-thoi-trang-2024-quan-bo-nam-form-chuan-shiny-mqk-013-i2510809269.html,0.5,25,10,,2024-07-23 13:42:02.199729,24500.0,24500.0
698,Quần jean nam retro,"Quần jean nam retro baggy CẠP CAO ống suông rộng, quần bò nam đen loang chất jeans cao cấp top xu hướng 2024 Zenko MQK 019",49000,https://www.lazada.vn/products/quan-jean-nam-retro-baggy-cap-cao-ong-suong-rong-quan-bo-nam-den-loang-chat-jeans-cao-cap-top-xu-huong-2024-zenko-mqk-019-i2510829073.html,0.69,105,45,Hà Nội,2024-07-23 13:42:02.199729,33810.0,15190.0
699,[Voucher 12%/149k] Quần Bò,[Voucher 12%/149k] Quần Bò Nam Rách Gối Vải Jean Phong Cách Trẻ Trung Xu Hướng Thời Trang Phối đồ Đa Dạng Soyoung MQK 004,49000,https://www.lazada.vn/products/voucher-12149k-quan-bo-nam-rach-goi-vai-jean-phong-cach-tre-trung-xu-huong-thoi-trang-phoi-do-da-dang-soyoung-mqk-004-i2439936880.html,0.5,164,83,,2024-07-23 13:42:02.199729,24500.0,24500.0
700,Quần Jean Nam DSQ,Quần Jean Nam DSQ Màu Xanh Vảy Sơn Khóa Sườn Hottrend Quần Bò Nam Thời Trang Chất Liệu DeHim Co Giãn Glamour MQK 017,49000,https://www.lazada.vn/products/quan-jean-nam-dsq-mau-xanh-vay-son-khoa-suon-hottrend-quan-bo-nam-thoi-trang-chat-lieu-dehim-co-gian-glamour-mqk-017-i2510692442.html,0.5,55,28,China,2024-07-23 13:42:02.199729,24500.0,24500.0
701,Quần Jean Cổ Điển,Quần Jean Cổ Điển Cho Nam Cỡ Lớn Quần Thể Thao Harem Dáng Rộng Dụng Cụ Mới Mùa Hè Quần Vải Bò Đã Giặt Thường Ngày Buộc Mắt Cá Chân Phong Cách Hàn Quốc Xưởng May Thanh Nga MQK 009,49000,https://www.lazada.vn/products/quan-jean-co-dien-cho-nam-co-lon-quan-the-thao-harem-dang-rong-dung-cu-moi-mua-he-quan-vai-bo-da-giat-thuong-ngay-buoc-mat-ca-chan-phong-cach-han-quoc-xuong-may-thanh-nga-mqk-009-i2505254239.html,0.5,12,1,,2024-07-23 13:42:02.199729,24500.0,24500.0
702,[Voucher 12%/149k] Quần Jean,[Voucher 12%/149k] Quần Jean Nữ Ống Suông Các Màu Cơ Bản Vải Jean Mềm Mịn Form Chuẩn Đẹp Phong Cách Thời Trang Phối Đồ Đa Dạng Soyoung WQK 003,49000,https://www.lazada.vn/products/voucher-12149k-quan-jean-nu-ong-suong-cac-mau-co-ban-vai-jean-mem-min-form-chuan-dep-phong-cach-thoi-trang-phoi-do-da-dang-soyoung-wqk-003-i2464562353.html,0.5,27,21,,2024-07-23 13:42:02.199729,24500.0,24500.0
703,[Voucher 12%/149k] Quần Jean,[Voucher 12%/149k] Quần Jean Cổ Điển Cho Nam Cỡ Lớn Quần Thể Thao Harem Dáng Rộng Dụng Cụ Mới Mùa Hè Quần Vải Bò Đã Giặt Thường Ngày Buộc Mắt Cá Chân Phong Cách Hàn Quốc Soyoung MQK 009,49000,https://www.lazada.vn/products/voucher-12149k-quan-jean-co-dien-cho-nam-co-lon-quan-the-thao-harem-dang-rong-dung-cu-moi-mua-he-quan-vai-bo-da-giat-thuong-ngay-buoc-mat-ca-chan-phong-cach-han-quoc-soyoung-mqk-009-i2505265278.html,0.5,90,58,Hà Nội,2024-07-23 13:42:02.199729,24500.0,24500.0
704,Quần jean nam ống,Quần jean nam ống rộng màu bạc rêu rách thời trang-2024 - quần bò nam form chuẩn Rich Man MQK 013,49000,https://www.lazada.vn/products/quan-jean-nam-ong-rong-mau-bac-reu-rach-thoi-trang-2024-quan-bo-nam-form-chuan-rich-man-mqk-013-i2510764136.html,0.5,104,90,,2024-07-23 13:42:02.199729,24500.0,24500.0
705,Quần jean nam ống,Quần jean nam ống rộng màu bạc rêu rách thời trang-2024 - quần bò nam form chuẩn Xưởng May Zenko MQK 013,49000,https://www.lazada.vn/products/quan-jean-nam-ong-rong-mau-bac-reu-rach-thoi-trang-2024-quan-bo-nam-form-chuan-xuong-may-zenko-mqk-013-i2510703812.html,0.5,0,0,China,2024-07-23 13:42:02.199729,24500.0,24500.0
706,Quần Jean Bò Nam,Quần Jean Bò Nam Rách Xù Hai Bên Đùi Vá Da Nhăn Kiểu Dáng Thời Trang Phong Cách đường phố Rich Man MQK 005,49000,https://www.lazada.vn/products/quan-jean-bo-nam-rach-xu-hai-ben-dui-va-da-nhan-kieu-dang-thoi-trang-phong-cach-duong-pho-rich-man-mqk-005-i2464561178.html,0.5,64,40,Đồng Nai,2024-07-23 13:42:02.199729,24500.0,24500.0
707,MARK BELT Quần Jean,MARK BELT Quần Jean Thời Trang Đường Phố Cho Nam Quần Bò Rách Co Giãn Ôm Sát Quần Biker Hip Hop Punk Thiết Kế Ghép Sơn,490000,https://www.lazada.vn/products/mark-belt-quan-jean-thoi-trang-duong-pho-cho-nam-quan-bo-rach-co-gian-om-sat-quan-biker-hip-hop-punk-thiet-ke-ghep-son-i1999490875.html,0.33,57,18,China,2024-07-23 13:42:02.199729,161700.0,328300.0
708,Quần Jean dài nam,Quần Jean dài nam cạp vừa kiểu năm túi kinh điển công nghệ Whisker thời trang thường ngày GIORDANO Free Shipping 13112055,492150,https://www.lazada.vn/products/quan-jean-dai-nam-cap-vua-kieu-nam-tui-kinh-dien-cong-nghe-whisker-thoi-trang-thuong-ngay-giordano-free-shipping-13112055-i1953878823.html,0.51,74,14,China,2024-07-23 13:42:02.199729,250996.5,241153.5
709,Quần Jean Ống Suông,"Quần Jean Ống Suông Cao Cấp Dành Cho Nam Mùa Xuân, Mùa Thu Xuất Hiện Độc Đáo Co Giãn Slims Smooths Hình Bóng Của Bạn",493900,https://www.lazada.vn/products/quan-jean-ong-suong-cao-cap-danh-cho-nam-mua-xuan-mua-thu-xuat-hien-doc-dao-co-gian-slims-smooths-hinh-bong-cua-ban-i2661057324.html,0.23,0,0,Hồ Chí Minh,2024-07-23 13:42:02.199729,113597.0,380303.0
710,Nam Slim Fit Quần,"Nam Slim Fit Quần Jean Nhẹ Mùa Xuân, Mùa Thu Công Sở Quần Mịn Hình Bóng Chân Thẳng Denim Đen",494200,https://www.lazada.vn/products/nam-slim-fit-quan-jean-nhe-mua-xuan-mua-thu-cong-so-quan-min-hinh-bong-chan-thang-denim-den-i2664656241.html,0.23,0,0,,2024-07-23 13:42:02.199729,113666.0,380534.0
711,Quần Jean Nam Giữa,Quần Jean Nam Giữa Eo Co Giãn Xanh Dương Rỗng Thêu Chữ Phong Cách Thường Ngày Đậm Thẳng Thường Phù Hợp Với,494200,https://www.lazada.vn/products/quan-jean-nam-giua-eo-co-gian-xanh-duong-rong-theu-chu-phong-cach-thuong-ngay-dam-thang-thuong-phu-hop-voi-i2664631551.html,0.23,0,0,,2024-07-23 13:42:02.199729,113666.0,380534.0
712,"Mùa Xuân, Mùa Thu","Mùa Xuân, Mùa Thu Nam Dáng Rộng Ống Thẳng Quần Jean Ống Rộng Áo Quần Cotton Không Co Giãn",494200,https://www.lazada.vn/products/mua-xuan-mua-thu-nam-dang-rong-ong-thang-quan-jean-ong-rong-ao-quan-cotton-khong-co-gian-i2664627673.html,0.0,0,0,,2024-07-23 13:42:02.199729,0.0,494200.0
713,Nam Slim Fit Xanh,Nam Slim Fit Xanh Nhạt Quần Jean Chân Thẳng Denim Quần Cotton Lưng Thun Thoáng Khí Nhanh Khô Cho Doanh Nghiệp,499000,https://www.lazada.vn/products/nam-slim-fit-xanh-nhat-quan-jean-chan-thang-denim-quan-cotton-lung-thun-thoang-khi-nhanh-kho-cho-doanh-nghiep-i2661813412.html,0.23,0,0,Hồ Chí Minh,2024-07-23 13:42:02.199729,114770.0,384230.0
714,Thuốc Nhuộm Quần Áo,Thuốc Nhuộm Quần Áo Giày Vải,50000,https://www.lazada.vn/products/thuoc-nhuom-quan-ao-giay-vai-i488294820.html,0.0,153,22,Hồ Chí Minh,2024-07-23 13:42:02.199729,0.0,50000.0
715,QUẦN JEAN BAGGY NAM,QUẦN JEAN BAGGY NAM BASIC XANH BẠC,50000,https://www.lazada.vn/products/quan-jean-baggy-nam-basic-xanh-bac-i1565185882.html,0.0,38,15,Hà Nội,2024-07-23 13:42:02.199729,0.0,50000.0
716,Quần Jean Nam Quần,Quần Jean Nam Quần Jean Nam Ống Loe Siêu Nhỏ Quần Ống Loe Cạp Vừa Co Giãn Quần Jean Màu Xanh,504000,https://www.lazada.vn/products/quan-jean-nam-quan-jean-nam-ong-loe-sieu-nho-quan-ong-loe-cap-vua-co-gian-quan-jean-mau-xanh-i746044744.html,0.43,45,18,,2024-07-23 13:42:02.199729,216720.0,287280.0
717,Phong Cách Mỹ Dáng,Phong Cách Mỹ Dáng Rộng Quần Jean Nam Hip Hop Chuông Đáy Thường Cảnh Quần Nam Hàng Mới Về,504200,https://www.lazada.vn/products/phong-cach-my-dang-rong-quan-jean-nam-hip-hop-chuong-day-thuong-canh-quan-nam-hang-moi-ve-i2661075224.html,0.0,0,0,,2024-07-23 13:42:02.199729,0.0,504200.0
718,Hợp Thời Trang Phong,Hợp Thời Trang Phong Cách Châu Âu Quần Jean Nam Nhẹ Sang Trọng Chân Thẳng Chống Phai Màu Ba Chiều Chặn Màu Mùa Xuân Bộ Sưu Tập,504400,https://www.lazada.vn/products/hop-thoi-trang-phong-cach-chau-au-quan-jean-nam-nhe-sang-trong-chan-thang-chong-phai-mau-ba-chieu-chan-mau-mua-xuan-bo-suu-tap-i2664453460.html,0.23,0,0,Hồ Chí Minh,2024-07-23 13:42:02.199729,116012.0,388388.0
719,Phong Cách Cao Cấp,Phong Cách Cao Cấp Chuông Đường Phố Đáy Quần Jean Nam Dáng Rộng Hậu Cung Quần Ông Già Mặc Thời Trang Thường Ngày,504400,https://www.lazada.vn/products/phong-cach-cao-cap-chuong-duong-pho-day-quan-jean-nam-dang-rong-hau-cung-quan-ong-gia-mac-thoi-trang-thuong-ngay-i2664593691.html,0.0,0,0,,2024-07-23 13:42:02.199729,0.0,504400.0
720,GIORDANO Men Jeans Moustache,GIORDANO Men Jeans Moustache Effect Mid Rise Denim Jeans Classic Five-Pocket Regular Simple Fashion Casual Denim Pants 01113085,509150,https://www.lazada.vn/products/giordano-men-jeans-moustache-effect-mid-rise-denim-jeans-classic-five-pocket-regular-simple-fashion-casual-denim-pants-01113085-i2421114889.html,0.49,16,5,,2024-07-23 13:42:02.199729,249483.5,259666.5
721,Quần Bò Đàn Hồi,Quần Bò Đàn Hồi Quần Nam Mẫu Xuân Thu Lót Lông Ống Đứng Rộng Rãi Mùa Thu Làm Việc Tại Công Trường Làm Việc Dày Dặn Mùa Đông Cho Nam,51000,https://www.lazada.vn/products/quan-bo-dan-hoi-quan-nam-mau-xuan-thu-lot-long-ong-dung-rong-rai-mua-thu-lam-viec-tai-cong-truong-lam-viec-day-dan-mua-dong-cho-nam-i2499615211.html,0.0,201,74,Hồ Chí Minh,2024-07-23 13:42:02.199729,0.0,51000.0
722,Quần Jean Denim Nam,Quần Jean Denim Nam Dáng Rộng Multipocket Làm Việc Đồng Phục Phong Cách Thường Ngày Quần Thời Trang Nhật Bản,510800,https://www.lazada.vn/products/quan-jean-denim-nam-dang-rong-multipocket-lam-viec-dong-phuc-phong-cach-thuong-ngay-quan-thoi-trang-nhat-ban-i2661170583.html,0.23,0,0,,2024-07-23 13:42:02.199729,117484.0,393316.0
723,Hợp Thời Trang Quần,Hợp Thời Trang Quần Jean Nam Xuân Hè 2024 Hàng Mới Về Ánh Sáng Sang Trọng Chân Thẳng Ôm Vừa Vặn Co Giãn Chân Quần Âu,513200,https://www.lazada.vn/products/hop-thoi-trang-quan-jean-nam-xuan-he-2024-hang-moi-ve-anh-sang-sang-trong-chan-thang-om-vua-van-co-gian-chan-quan-au-i2661413597.html,0.0,0,0,,2024-07-23 13:42:02.199729,0.0,513200.0
724,GIORDANO Men Moustache Effect,GIORDANO Men Moustache Effect Five-Pocket Denim Mid Rise Quality Zip Summer Fashion Casual Denim 18114619,517650,https://www.lazada.vn/products/giordano-men-moustache-effect-five-pocket-denim-mid-rise-quality-zip-summer-fashion-casual-denim-18114619-i2644096380.html,0.48,0,1,China,2024-07-23 13:42:02.199729,248472.0,269178.0
725,Thu Đông 2024 Nam,Thu Đông 2024 Nam Chân Thẳng Quần Âu Giảm Béo Bằng Độ Đàn Hồi Miễn Phí Vận Chuyển,519500,https://www.lazada.vn/products/thu-dong-2024-nam-chan-thang-quan-au-giam-beo-bang-do-dan-hoi-mien-phi-van-chuyen-i2661407404.html,0.23,0,0,Nước ngoài,2024-07-23 13:42:02.199729,119485.0,400015.0
726,Nam Ống Thẳng Co,Nam Ống Thẳng Co Giãn Quần Jean Denim Cao Cấp Phong Cách Thường Ngày Lông Cừu Thường Phù Hợp Cho Mùa Thu/Mùa Đông,519500,https://www.lazada.vn/products/nam-ong-thang-co-gian-quan-jean-denim-cao-cap-phong-cach-thuong-ngay-long-cuu-thuong-phu-hop-cho-mua-thumua-dong-i2661085692.html,0.23,0,0,Hồ Chí Minh,2024-07-23 13:42:02.199729,119485.0,400015.0
727,Nam Ống Thẳng Quần,"Nam Ống Thẳng Quần Jean Cổ Giữa Eo Công Sở Quần Ôm Vừa Vặn Độ Đàn Hồi Quần Dài Cho Mùa Xuân, Mùa Thu",519500,https://www.lazada.vn/products/nam-ong-thang-quan-jean-co-giua-eo-cong-so-quan-om-vua-van-do-dan-hoi-quan-dai-cho-mua-xuan-mua-thu-i2661075064.html,0.23,0,0,Hồ Chí Minh,2024-07-23 13:42:02.199729,119485.0,400015.0
728,Quần Jean Nam Thu,Quần Jean Nam Thu Đông 2024 Giặt Thoáng Khí Thêu Giảm Béo Mịn Hình Bóng Nhỏ Chân Thẳng Cổ Mảnh,519500,https://www.lazada.vn/products/quan-jean-nam-thu-dong-2024-giat-thoang-khi-theu-giam-beo-min-hinh-bong-nho-chan-thang-co-manh-i2661435731.html,0.0,0,0,,2024-07-23 13:42:02.199729,0.0,519500.0
729,Nam Thu Đông 2024,Nam Thu Đông 2024 Chân Thẳng Giảm Béo Quần Jean Thường Ngày Cảnh Áp Dụng Làm Mịn Hình Bóng Tăng Cường Quần Thẳng Miễn Phí Vận Chuyển,519500,https://www.lazada.vn/products/nam-thu-dong-2024-chan-thang-giam-beo-quan-jean-thuong-ngay-canh-ap-dung-lam-min-hinh-bong-tang-cuong-quan-thang-mien-phi-van-chuyen-i2661186338.html,0.23,0,0,Hồ Chí Minh,2024-07-23 13:42:02.199729,119485.0,400015.0
730,Nam Thu Đông Quần,Nam Thu Đông Quần Jean Slim Fit Chân Thẳng Quần Âu Cao Cấp Giảm Béo Hiệu Quả Mịn Ra Hình Bóng Của Bạn,519500,https://www.lazada.vn/products/nam-thu-dong-quan-jean-slim-fit-chan-thang-quan-au-cao-cap-giam-beo-hieu-qua-min-ra-hinh-bong-cua-ban-i2661324155.html,0.0,0,0,,2024-07-23 13:42:02.199729,0.0,519500.0
731,Quần Jean Nam Chân,Quần Jean Nam Chân Thẳng Giảm Béo Quần Âu Thu Đông 2024 Hình Bóng Mịn Tăng Cường Thường Xanh Dương Thẳng Quần,519800,https://www.lazada.vn/products/quan-jean-nam-chan-thang-giam-beo-quan-au-thu-dong-2024-hinh-bong-min-tang-cuong-thuong-xanh-duong-thang-quan-i2664803709.html,0.23,0,0,,2024-07-23 13:42:02.199729,119554.0,400246.0
732,Mùa Xuân Năm 2024,Mùa Xuân Năm 2024 Kaki Nam Quần Jean Slim Fit Chân Thẳng Quần Công Sở Mịn Hình Bóng Đa Năng Cho Tất Cả Các Mùa,520100,https://www.lazada.vn/products/mua-xuan-nam-2024-kaki-nam-quan-jean-slim-fit-chan-thang-quan-cong-so-min-hinh-bong-da-nang-cho-tat-ca-cac-mua-i2661038585.html,0.23,0,0,,2024-07-23 13:42:02.199729,119623.0,400477.0
733,Nam Co Giãn Slim,Nam Co Giãn Slim Fit Quần Jean Mùa Xuân 2024 Phong Cách Mới Nhỏ Quần Ống Suông Mùa Thu Nam Quần Miễn Phí vận Chuyển,520100,https://www.lazada.vn/products/nam-co-gian-slim-fit-quan-jean-mua-xuan-2024-phong-cach-moi-nho-quan-ong-suong-mua-thu-nam-quan-mien-phi-van-chuyen-i2661471201.html,0.0,0,0,,2024-07-23 13:42:02.199729,0.0,520100.0
734,Năm 2023 Nam Thu,Năm 2023 Nam Thu Xuân Quần Jean Co Giãn Slim Fit Hàn Quốc Hợp Thời Trang Nhỏ Chân Thẳng Quần Denim,524700,https://www.lazada.vn/products/nam-2023-nam-thu-xuan-quan-jean-co-gian-slim-fit-han-quoc-hop-thoi-trang-nho-chan-thang-quan-denim-i2661379837.html,0.0,0,0,,2024-07-23 13:42:02.199729,0.0,524700.0
735,Quần Jean Nam Dáng,Quần Jean Nam Dáng Rộng Chân Thẳng Dạo Phố Cao Cấp Vintage Cổ Đa Năng Quần Dài Mùa Hè Hàng Mới Về,529300,https://www.lazada.vn/products/quan-jean-nam-dang-rong-chan-thang-dao-pho-cao-cap-vintage-co-da-nang-quan-dai-mua-he-hang-moi-ve-i2661248375.html,0.0,0,0,,2024-07-23 13:42:02.199729,0.0,529300.0
736,Nam Vintage Punk Hợp,Nam Vintage Punk Hợp Thời Trang Quần Jeans Rách Xanh Denim Co Giãn Eo Phong Cách Giản Dị Slim Fit Lưng Thun Quần Jean Nam,529800,https://www.lazada.vn/products/nam-vintage-punk-hop-thoi-trang-quan-jeans-rach-xanh-denim-co-gian-eo-phong-cach-gian-di-slim-fit-lung-thun-quan-jean-nam-i2661108846.html,0.23,0,0,Hà Nội,2024-07-23 13:42:02.199729,121854.0,407946.0
737,Quần Jean Nam Thêu,Quần Jean Nam Thêu Xanh 2023 Slim Fit Quần Tây Nhỏ Chân Phong Cách Đa Năng Cho Mùa Thu/Mùa Đông,529800,https://www.lazada.vn/products/quan-jean-nam-theu-xanh-2023-slim-fit-quan-tay-nho-chan-phong-cach-da-nang-cho-mua-thumua-dong-i2661010418.html,0.0,0,0,,2024-07-23 13:42:02.199729,0.0,529800.0
738,Nam Slim Fit Quần,Nam Slim Fit Quần Jean Cao Cấp Đầu Thu Mới Xuất Hiện Micro Loe Hợp Thời Trang Co Giãn Quần Ống Suông,534900,https://www.lazada.vn/products/nam-slim-fit-quan-jean-cao-cap-dau-thu-moi-xuat-hien-micro-loe-hop-thoi-trang-co-gian-quan-ong-suong-i2663820510.html,0.0,0,0,,2024-07-23 13:42:02.199729,0.0,534900.0
739,Năm 2024 Quần Jean,Năm 2024 Quần Jean Nam Phong Cách Hàn Quốc Slim Fit Co Giãn Thêu Chữ Thường Quần Ống Suông Mịn Hình Bóng Cho Xuân Hè,536200,https://www.lazada.vn/products/nam-2024-quan-jean-nam-phong-cach-han-quoc-slim-fit-co-gian-theu-chu-thuong-quan-ong-suong-min-hinh-bong-cho-xuan-he-i2661843564.html,0.23,0,0,Phú Yên,2024-07-23 13:42:02.199729,123326.0,412874.0
740,Năm 2024 Nam Chân,"Năm 2024 Nam Chân Thẳng Vintage Quần Jean Dáng Rộng Phong Cách Thường Ngày Chuông Mỹ Đáy Cho Mùa Xuân, Mùa Thu",537900,https://www.lazada.vn/products/nam-2024-nam-chan-thang-vintage-quan-jean-dang-rong-phong-cach-thuong-ngay-chuong-my-day-cho-mua-xuan-mua-thu-i2666430670.html,0.0,0,0,,2024-07-23 13:42:02.199729,0.0,537900.0
741,"Mùa Xuân, Mùa Thu","Mùa Xuân, Mùa Thu 2024 Quần Jean Nam Chân Thẳng Hợp Thời Trang Thương Hiệu Co Giãn Slims Mịn Quần Tây Miễn Phí Vận Chuyển",538500,https://www.lazada.vn/products/mua-xuan-mua-thu-2024-quan-jean-nam-chan-thang-hop-thoi-trang-thuong-hieu-co-gian-slims-min-quan-tay-mien-phi-van-chuyen-i2661056655.html,0.23,0,0,Đà Nẵng,2024-07-23 13:42:02.199729,123855.0,414645.0
742,Quần Bò Nam JEEP,"Quần Bò Nam JEEP SPIRIT, Công Sở Đẹp Trai Thường Ngày Dáng Suông Rộng Dáng Suông",539000,https://www.lazada.vn/products/quan-bo-nam-jeep-spirit-cong-so-dep-trai-thuong-ngay-dang-suong-rong-dang-suong-i1423225153.html,0.46,42,16,Hồ Chí Minh,2024-07-23 13:42:02.199729,247940.0,291060.0
743,Quần Bò Nam JEEP,"Quần Bò Nam JEEP SPIRIT, Dáng Suông Rộng Phù Hợp Với Mọi Loại Công Sở Thường Ngày Ngoài Trời",539000,https://www.lazada.vn/products/quan-bo-nam-jeep-spirit-dang-suong-rong-phu-hop-voi-moi-loai-cong-so-thuong-ngay-ngoai-troi-i1423203558.html,0.46,40,24,,2024-07-23 13:42:02.199729,247940.0,291060.0
744,[HCM]Quần Short Jean Nam,[HCM]Quần Short Jean Nam Cotton Cao Cấp ht,54000,https://www.lazada.vn/products/hcmquan-short-jean-nam-cotton-cao-cap-ht-i1540905239.html,0.0,104,24,,2024-07-23 13:42:02.199729,0.0,54000.0
745,Thương Hiệu Hợp Thời,Thương Hiệu Hợp Thời Trang Quần Jean Nam Nhẹ Sang Trọng Thẳng Chân Co Giãn Casualslims Kích Thước Nhỏ Làm Mịn Hình Bóng Của Bạn Cho Mùa Thu,540100,https://www.lazada.vn/products/thuong-hieu-hop-thoi-trang-quan-jean-nam-nhe-sang-trong-thang-chan-co-gian-casualslims-kich-thuoc-nho-lam-min-hinh-bong-cua-ban-cho-mua-thu-i2661528417.html,0.23,0,0,,2024-07-23 13:42:02.199729,124223.0,415877.0
746,Nam Phong Cách Hàn,"Nam Phong Cách Hàn Quốc Quần Jean Giảm Béo Chân Thẳng Độ Đàn Hồi Quần Áo Cắt Chín Điểm Cho Mùa Xuân, Mùa Thu",540100,https://www.lazada.vn/products/nam-phong-cach-han-quoc-quan-jean-giam-beo-chan-thang-do-dan-hoi-quan-ao-cat-chin-diem-cho-mua-xuan-mua-thu-i2661113678.html,0.23,0,0,Hồ Chí Minh,2024-07-23 13:42:02.199729,124223.0,415877.0
747,Nam Phong Cách Vintage,Nam Phong Cách Vintage Dáng Rộng Quần Jean Thêu Chân Thẳng Quần Tây Nhập Khẩu Từ Nhật Bản Miễn Phí Vận Chuyển,540100,https://www.lazada.vn/products/nam-phong-cach-vintage-dang-rong-quan-jean-theu-chan-thang-quan-tay-nhap-khau-tu-nhat-ban-mien-phi-van-chuyen-i2661291526.html,0.23,0,0,,2024-07-23 13:42:02.199729,124223.0,415877.0
748,"Mùa Xuân, Mùa Thu","Mùa Xuân, Mùa Thu 2023 Nam Slim Fit Quần Jean Hợp Thời Trang Phong Cách Hàn Quốc Chân Thẳng Quần Cotton Slim Fit Quần Denim Miễn Phí vận Chuyển",540100,https://www.lazada.vn/products/mua-xuan-mua-thu-2023-nam-slim-fit-quan-jean-hop-thoi-trang-phong-cach-han-quoc-chan-thang-quan-cotton-slim-fit-quan-denim-mien-phi-van-chuyen-i2661203654.html,0.23,0,0,,2024-07-23 13:42:02.199729,124223.0,415877.0
749,"Mùa Xuân, Mùa Thu","Mùa Xuân, Mùa Thu Quần Jean Nam Dáng Rộng Chân Thẳng Cổ Vintage Chuông Đáy Phong Cách Mỹ Dạo Phố Cao Cấp Hợp Thời Trang",540100,https://www.lazada.vn/products/mua-xuan-mua-thu-quan-jean-nam-dang-rong-chan-thang-co-vintage-chuong-day-phong-cach-my-dao-pho-cao-cap-hop-thoi-trang-i2661057200.html,0.0,0,0,,2024-07-23 13:42:02.199729,0.0,540100.0
750,Quần Jean Nam Mới,Quần Jean Nam Mới Thu Slim Fit Mịn Hình Bóng Nhỏ Thêu Co Giãn Hợp Thời Trang Thương Hiệu Ga Châu Âu Quần Thường Ngày,540300,https://www.lazada.vn/products/quan-jean-nam-moi-thu-slim-fit-min-hinh-bong-nho-theu-co-gian-hop-thoi-trang-thuong-hieu-ga-chau-au-quan-thuong-ngay-i2664569660.html,0.23,0,0,,2024-07-23 13:42:02.199729,124269.0,416031.0
751,Quần Jean Vải Modal,Quần Jean Vải Modal Quần Nam Trẻ Trung Thường Ngày Siêu Mỏng Dáng Suông Màu Xanh Nhạt,543100,https://www.lazada.vn/products/quan-jean-vai-modal-quan-nam-tre-trung-thuong-ngay-sieu-mong-dang-suong-mau-xanh-nhat-i1747456691.html,0.33,65,13,,2024-07-23 13:42:02.199729,179223.0,363877.0
752,Thương Hiệu Hợp Thời,Thương Hiệu Hợp Thời Trang Nam Có Lỗ Quần Short Denim Slim Fit Xe Máy Quần Lưng Thun Viền Ghép Đeo Quần Jean,543100,https://www.lazada.vn/products/thuong-hieu-hop-thoi-trang-nam-co-lo-quan-short-denim-slim-fit-xe-may-quan-lung-thun-vien-ghep-deo-quan-jean-i2661059192.html,0.23,0,0,,2024-07-23 13:42:02.199729,124913.0,418187.0
753,Nam Vintage Chân Thẳng,Nam Vintage Chân Thẳng Denim Jeans Chuông Đáy Dáng Rộng Nhiều Túi Cao Cấp Thời Trang Đường Phố Phong Cách Mỹ,543400,https://www.lazada.vn/products/nam-vintage-chan-thang-denim-jeans-chuong-day-dang-rong-nhieu-tui-cao-cap-thoi-trang-duong-pho-phong-cach-my-i2664633490.html,0.23,0,0,,2024-07-23 13:42:02.199729,124982.0,418418.0
754,Quần Jean Nam Dáng,Quần Jean Nam Dáng Rộng Cổ Hậu Cung Quần Phong Cách Nhật Bản Thu Xuân Nam Quần Áo Miễn Phí Vận Chuyển,545200,https://www.lazada.vn/products/quan-jean-nam-dang-rong-co-hau-cung-quan-phong-cach-nhat-ban-thu-xuan-nam-quan-ao-mien-phi-van-chuyen-i2661692532.html,0.23,0,0,Hồ Chí Minh,2024-07-23 13:42:02.199729,125396.0,419804.0
