id,Name,title,price,link_item,discount,sold,evaluate,location,timestamp,discount_value,final_price
283,Quần jean nam dài,Quần jean nam dài rách xước 2 Đáy siêu hot mẫu mới nhập hàng quảng châu cao cấp thời trang trẻ trung shop HH_STOREE,185000,https://www.lazada.vn/products/quan-jean-nam-dai-rach-xuoc-2-day-sieu-hot-mau-moi-nhap-hang-quang-chau-cao-cap-thoi-trang-tre-trung-shop-hh_storee-i2417632694.html,0.29,43,13,Hồ Chí Minh,2024-07-23 13:42:02.199729,53649.99999999999,131350.0
284,Quần jean nam dsq2,"Quần jean nam dsq2 xanh séc ngang,quần dsquared2 nam 4 cúc",185000,https://www.lazada.vn/products/quan-jean-nam-dsq2-xanh-sec-ngangquan-dsquared2-nam-4-cuc-i2501920286.html,0.26,57,22,,2024-07-23 13:42:02.199729,48100.0,136900.0
285,Quần Bò Nam Cho,Quần Bò Nam Cho Người Trung Niên Và Già Quần Bố Mẫu Xuân Thu Quần Thoải Mái Cạp Chun Quần Nam Trung Niên Mẫu Mỏng Mùa Hè,186000,https://www.lazada.vn/products/quan-bo-nam-cho-nguoi-trung-nien-va-gia-quan-bo-mau-xuan-thu-quan-thoai-mai-cap-chun-quan-nam-trung-nien-mau-mong-mua-he-i1940856086.html,0.73,35,11,Hồ Chí Minh,2024-07-23 13:42:02.199729,135780.0,50220.0
286,Wthinlee Quần jean nam,Wthinlee Quần jean nam công sở mới Quần denim công sở màu xanh đen cổ điển thời trang co giãn thẳng thường ngày quần áo thương hiệu nam,188700,https://www.lazada.vn/products/wthinlee-quan-jean-nam-cong-so-moi-quan-denim-cong-so-mau-xanh-den-co-dien-thoi-trang-co-gian-thang-thuong-ngay-quan-ao-thuong-hieu-nam-i2581091590.html,0.23,41,179,,2024-07-23 13:42:02.199729,43401.0,145299.0
287,Quần Bò Nam Phun,Quần Bò Nam Phun Nhuộm Quần Rộng ỐNg RộNg ỐNg RộNg Đường Phố Thương Hiệu Thời Trang Instagram Quần Dài Quét Đất Ống Đứng Rộng Rãi Cảm Giác Rủ Cổ Điển,189000,https://www.lazada.vn/products/quan-bo-nam-phun-nhuom-quan-rong-ong-rong-ong-rong-duong-pho-thuong-hieu-thoi-trang-instagram-quan-dai-quet-dat-ong-dung-rong-rai-cam-giac-ru-co-dien-i1641734343.html,0.52,79,11,Hồ Chí Minh,2024-07-23 13:42:02.199729,98280.0,90720.0
288,Bộ Nhật Nam,Bộ Nhật Nam,189000,https://www.lazada.vn/products/bo-nhat-nam-i1752720955.html,0.0,46,10,,2024-07-23 13:42:02.199729,0.0,189000.0
289,Quần yếm unisex cho,Quần yếm unisex cho nam và nữ - Phong cách hàn quốc,189000,https://www.lazada.vn/products/quan-yem-unisex-cho-nam-va-nu-phong-cach-han-quoc-i1028860492.html,0.14,86,21,,2024-07-23 13:42:02.199729,26460.000000000004,162540.0
290,Quần jean nam ống,Quần jean nam ống loe - jean dài co giãn tốt- quần bò nam hàn quốc,189000,https://www.lazada.vn/products/quan-jean-nam-ong-loe-jean-dai-co-gian-tot-quan-bo-nam-han-quoc-i1807042895.html,0.21,45,13,,2024-07-23 13:42:02.199729,39690.0,149310.0
291,Quần Short Jean Nam,Quần Short Jean Nam Màu Bụi Xuất Xịn Đẹp Giá Rẻ,189000,https://www.lazada.vn/products/quan-short-jean-nam-mau-bui-xuat-xin-dep-gia-re-i1802032477.html,0.37,183,49,,2024-07-23 13:42:02.199729,69930.0,119070.0
292,ASRV quần jean quần,ASRV quần jean quần bò nam quần đũi dài pants jeans for men Quần jeans nam cổ điển rửa thời trang Phục Hưng quần ống đứng dáng rộng thường ngày,190000,https://www.lazada.vn/products/asrv-quan-jean-quan-bo-nam-quan-dui-dai-pants-jeans-for-men-quan-jeans-nam-co-dien-rua-thoi-trang-phuc-hung-quan-ong-dung-dang-rong-thuong-ngay-i2386761099.html,0.5,64,63,,2024-07-23 13:42:02.199729,95000.0,95000.0
293,Quần Đùi Nam Chất,Quần Đùi Nam Chất Bò Thời Trang Cao Cấp,190000,https://www.lazada.vn/products/quan-dui-nam-chat-bo-thoi-trang-cao-cap-i1801973743.html,0.37,13,352,Hồ Chí Minh,2024-07-23 13:42:02.199729,70300.0,119700.0
294,Hanlu Quần Denim Dáng,Hanlu Quần Denim Dáng Đứng Của Nam Giới Lỏng Lẻo Giản Dị Ánh Sáng Phong Cách Hồng Kông Quần Âu Bé Trai Hợp Thời Trang Sinh Viên Quần Lửng,191000,https://www.lazada.vn/products/hanlu-quan-denim-dang-dung-cua-nam-gioi-long-leo-gian-di-anh-sang-phong-cach-hong-kong-quan-au-be-trai-hop-thoi-trang-sinh-vien-quan-lung-i2131675942.html,0.4,215,212,,2024-07-23 13:42:02.199729,76400.0,114600.0
295,ASRV quần jean quần,ASRV quần jean quần bò nam quần đũi dài pants jeans for men Nam đường phố Mỹ Niche Quần Jean Rách in chữ cái Retro hip hop quần denim ống đứng dáng rộng thường ngày,192000,https://www.lazada.vn/products/asrv-quan-jean-quan-bo-nam-quan-dui-dai-pants-jeans-for-men-nam-duong-pho-my-niche-quan-jean-rach-in-chu-cai-retro-hip-hop-quan-denim-ong-dung-dang-rong-thuong-ngay-i2424895328.html,0.5,69,62,,2024-07-23 13:42:02.199729,96000.0,96000.0
296,(Có video) Quần jean,(Có video) Quần jean nam màu đen trơn Za.Ra co giãn bốn chiều chống nhăn xuất khẩu,195000,https://www.lazada.vn/products/co-video-quan-jean-nam-mau-den-tron-zara-co-gian-bon-chieu-chong-nhan-xuat-khau-i814448928.html,0.35,113,2686,China,2024-07-23 13:42:02.199729,68250.0,126750.0
297,Quần Jean Nam Họa,Quần Jean Nam Họa Tiết Thêu Hoa Màu Đen Và Xám Slim Fit Thoáng Mát Cá Tính Thời Trang Hợp Thời Trang Quần Co Giãn Thường Ngày,196800,https://www.lazada.vn/products/quan-jean-nam-hoa-tiet-theu-hoa-mau-den-va-xam-slim-fit-thoang-mat-ca-tinh-thoi-trang-hop-thoi-trang-quan-co-gian-thuong-ngay-i2615428846.html,0.23,0,1,,2024-07-23 13:42:02.199729,45264.0,151536.0
298,Quần jean mỹ nam,Quần jean mỹ nam ôm gọn thẳng đẹp trai mùa thu mới đa năng Quần Retro,197400,https://www.lazada.vn/products/quan-jean-my-nam-om-gon-thang-dep-trai-mua-thu-moi-da-nang-quan-retro-i2635508434.html,0.23,0,0,,2024-07-23 13:42:02.199729,45402.0,151998.0
299,Quần bò suông nam,Quần bò suông nam cao cấp màu đen khói xám,198000,https://www.lazada.vn/products/quan-bo-suong-nam-cao-cap-mau-den-khoi-xam-i2154896597.html,0.0,131,29,Hồ Chí Minh,2024-07-23 13:42:02.199729,0.0,198000.0
300,Quần jean ống suông,"Quần jean ống suông nam cao cấp, chất bò xịn co dãn nhẹ,3 màu siêu hot: Đen xì-Đen xám khói-xanh",199000,https://www.lazada.vn/products/quan-jean-ong-suong-nam-cao-cap-chat-bo-xin-co-dan-nhe3-mau-sieu-hot-den-xi-den-xam-khoi-xanh-i2294609398.html,0.56,79,19,,2024-07-23 13:42:02.199729,111440.00000000001,87559.99999999999
301,Quần Jean Nam Túi,Quần Jean Nam Túi Đứng co giãn ôm vừa thoải mái chất bò xịn,199000,https://www.lazada.vn/products/quan-jean-nam-tui-dung-co-gian-om-vua-thoai-mai-chat-bo-xin-i2241274073.html,0.43,20,851,,2024-07-23 13:42:02.199729,85570.0,113430.0
302,[FREE SHIP] Quần Baggy,[FREE SHIP] Quần Baggy Nam Ống Rộng Anyoung Quần Jean Nam Dáng Xuông Form Rộng Chuẩn Hàn Quốc Thời Trang Unisex Phù Hợp Cho Cả Nam Và Nữ QD18,199000,https://www.lazada.vn/products/free-ship-quan-baggy-nam-ong-rong-anyoung-quan-jean-nam-dang-xuong-form-rong-chuan-han-quoc-thoi-trang-unisex-phu-hop-cho-ca-nam-va-nu-qd18-i1877685912.html,0.5,820,263,,2024-07-23 13:42:02.199729,99500.0,99500.0
303,YIPINYOUYOU丨Quần Jean Nam-Quần jean,YIPINYOUYOU丨Quần Jean Nam-Quần jean nam mỏng ống suông lỏng quần denim nhẹ cổ điển thoải mái,199000,https://www.lazada.vn/products/yipinyouyouquan-jean-nam-quan-jean-nam-mong-ong-suong-long-quan-denim-nhe-co-dien-thoai-mai-i2409312022.html,0.4,236,96,Nước ngoài,2024-07-23 13:42:02.199729,79600.0,119400.0
304,Set bộ đũi tay,"Set bộ đũi tay dài trung niên, áo cổ tàu mềm mát - Bộ đồ lam đi chùa",199000,https://www.lazada.vn/products/set-bo-dui-tay-dai-trung-nien-ao-co-tau-mem-mat-bo-do-lam-di-chua-i1453309900.html,0.33,23,585,,2024-07-23 13:42:02.199729,65670.0,133330.0
305,Quần suông đen xám,"Quần suông đen xám khói cai cấp , ống 22-23cm from cực đẹp chất vải loại 1 dành cho nam(size 28/34)",199000,https://www.lazada.vn/products/quan-suong-den-xam-khoi-cai-cap-ong-22-23cm-from-cuc-dep-chat-vai-loai-1-danh-cho-namsize-2834-i2406445362.html,0.5,79,25,,2024-07-23 13:42:02.199729,99500.0,99500.0
306,Quần jean bò nam,Quần jean bò nam Amiri slimfit xanh rách tua đùi gối vá vải đính đá bạc phối vảy sơn phong cách boy phố,199000,https://www.lazada.vn/products/quan-jean-bo-nam-amiri-slimfit-xanh-rach-tua-dui-goi-va-vai-dinh-da-bac-phoi-vay-son-phong-cach-boy-pho-i2529788988.html,0.58,0,0,Hà Nội,2024-07-23 13:42:02.199729,115419.99999999999,83580.00000000001
307,Mẫu bộ đũi tay,"Mẫu bộ đũi tay dài TRUNG NIÊN, Hàng cực đẹp, Chất cực tốt, Chuẩn đũi mộc 100%, Dày dặn, Đẹp mê! T5",199000,https://www.lazada.vn/products/mau-bo-dui-tay-dai-trung-nien-hang-cuc-dep-chat-cuc-tot-chuan-dui-moc-100-day-dan-dep-me-t5-i1453363402.html,0.33,55,1474,Hồ Chí Minh,2024-07-23 13:42:02.199729,65670.0,133330.0
308,Người Đàn Ông Mới,Người Đàn Ông Mới Cổ Điển Jeans Jean Homme Pantalones Hombre Người Đàn Ông Mannen Mềm Màu Đen Biker Masculino Denim Quần Mens Quần Kích Thước 32-38,199200,https://www.lazada.vn/products/nguoi-dan-ong-moi-co-dien-jeans-jean-homme-pantalones-hombre-nguoi-dan-ong-mannen-mem-mau-den-biker-masculino-denim-quan-mens-quan-kich-thuoc-32-38-i2434563715.html,0.23,42,23,China,2024-07-23 13:42:02.199729,45816.0,153384.0
309,Màu Đen Cổ Điển,Màu Đen Cổ Điển Denim Quần Jean Nam Slim Fit Giữa Eo Có Dây Kéo Bay Phong Cách Đường Phố Áo Liền Quần Cho Doanh Nghiệp,199200,https://www.lazada.vn/products/mau-den-co-dien-denim-quan-jean-nam-slim-fit-giua-eo-co-day-keo-bay-phong-cach-duong-pho-ao-lien-quan-cho-doanh-nghiep-i2434505887.html,0.23,17,35,China,2024-07-23 13:42:02.199729,45816.0,153384.0
310,Semir Quần Jean Nam,Semir Quần Jean Nam Quần Giặt Mùa Đông 2024 Dáng Ôm Phong Cách Cổ Điển Màu Trơn Xu Hướng Ins quần girl phố,200000,https://www.lazada.vn/products/semir-quan-jean-nam-quan-giat-mua-dong-2024-dang-om-phong-cach-co-dien-mau-tron-xu-huong-ins-quan-girl-pho-i2052048496.html,0.47,631,155,,2024-07-23 13:42:02.199729,94000.0,106000.0
311,Nam Cao Cấp Quần,Nam Cao Cấp Quần Jean Ống Rộng Công Sở Ống Thẳng Mùa Thu Hợp Thời Trang Cotton Lụa Nhẹ Bán Buôn,200800,https://www.lazada.vn/products/nam-cao-cap-quan-jean-ong-rong-cong-so-ong-thang-mua-thu-hop-thoi-trang-cotton-lua-nhe-ban-buon-i2631581941.html,0.45,5,0,,2024-07-23 13:42:02.199729,90360.0,110440.0
312,Màu Xanh Cổ Điển,Màu Xanh Cổ Điển Co Giãn Denim Quần Jean Nam Thông Minh Phong Cách Doanh Nhân Có Dây Kéo Bay Giữa Eo Thẳng Thường Phù Hợp Cho Mùa Xuân Và Mùa Thu,201000,https://www.lazada.vn/products/mau-xanh-co-dien-co-gian-denim-quan-jean-nam-thong-minh-phong-cach-doanh-nhan-co-day-keo-bay-giua-eo-thang-thuong-phu-hop-cho-mua-xuan-va-mua-thu-i2625146857.html,0.16,312,0,Hồ Chí Minh,2024-07-23 13:42:02.199729,32160.0,168840.0
313,ASRV quần jean quần,ASRV quần jean quần bò nam quần đũi dài pants jeans for men Quần dài sàn Denim Ống rộng phong cách Hàn Quốc và đa năng cho nam quần dài Denim rách,201000,https://www.lazada.vn/products/asrv-quan-jean-quan-bo-nam-quan-dui-dai-pants-jeans-for-men-quan-dai-san-denim-ong-rong-phong-cach-han-quoc-va-da-nang-cho-nam-quan-dai-denim-rach-i2424911056.html,0.5,42,64,Hồ Chí Minh,2024-07-23 13:42:02.199729,100500.0,100500.0
314,Quần Bò Ống Đứng,Quần Bò Ống Đứng Rộng Rãi Mùa Xuân Quần Nam Sành Điệu Đường Phố Cao Tầng Quần Dài Cá Tính Dễ Phối Thường Ngày Thương Hiệu Sành Điệu Instagram Phong Cách Hồng Kông,202000,https://www.lazada.vn/products/quan-bo-ong-dung-rong-rai-mua-xuan-quan-nam-sanh-dieu-duong-pho-cao-tang-quan-dai-ca-tinh-de-phoi-thuong-ngay-thuong-hieu-sanh-dieu-instagram-phong-cach-hong-kong-i1665250449.html,0.0,153,44,,2024-07-23 13:42:02.199729,0.0,202000.0
315,ASRV quần jean quần,ASRV quần jean quần bò nam quần đũi dài pants jeans for men Quần Mùa Hè Quần Bò Ống Đứng Co Giãn Cao Nhiều Túi Dáng Rộng Mùa Hè Mỏng Thường Ngày Hoang Dã Phong Cách Hàn Quốc Quần Dài Hợp Thời Trang Cho Nam,202000,https://www.lazada.vn/products/asrv-quan-jean-quan-bo-nam-quan-dui-dai-pants-jeans-for-men-quan-mua-he-quan-bo-ong-dung-co-gian-cao-nhieu-tui-dang-rong-mua-he-mong-thuong-ngay-hoang-da-phong-cach-han-quoc-quan-dai-hop-thoi-trang-cho-nam-i2226948148.html,0.49,306,258,,2024-07-23 13:42:02.199729,98980.0,103020.0
316,Nam Retro Moto Biker,Nam Retro Moto Biker Thẳng Quần Jean Có Dây Kéo Bay Dạo Phố Punk Skinny Denim Hàng Hóa Quần Y2k Phong Cách Giữa Eo Chiều Dài,202100,https://www.lazada.vn/products/nam-retro-moto-biker-thang-quan-jean-co-day-keo-bay-dao-pho-punk-skinny-denim-hang-hoa-quan-y2k-phong-cach-giua-eo-chieu-dai-i2625306797.html,0.45,197,8,China,2024-07-23 13:42:02.199729,90945.0,111155.0
317,SUPEEON丨Quần Nam Thêu Quần,SUPEEON丨Quần Nam Thêu Quần Jean Thời Trang Đơn Giản Dáng Rộng Mới,204000,https://www.lazada.vn/products/supeeonquan-nam-theu-quan-jean-thoi-trang-don-gian-dang-rong-moi-i2228239461.html,0.5,87,83,,2024-07-23 13:42:02.199729,102000.0,102000.0
318,ASRV quần jean quần,ASRV quần jean quần bò nam quần đũi dài pants jeans for men Quần dài nam quần Jean ống đứng dáng rộng giản dị và sang trọng,206000,https://www.lazada.vn/products/asrv-quan-jean-quan-bo-nam-quan-dui-dai-pants-jeans-for-men-quan-dai-nam-quan-jean-ong-dung-dang-rong-gian-di-va-sang-trong-i2259427517.html,0.49,514,461,Hà Nội,2024-07-23 13:42:02.199729,100940.0,105060.0
319,Plus Size Jeans Men,Plus Size Jeans Men 29-38 100kg 2022 Autunm and Winter New Loose Casual Stretch Jeans Casual Denim Trousers for Men Straight Cut,206371,https://www.lazada.vn/products/plus-size-jeans-men-29-38-100kg-2022-autunm-and-winter-new-loose-casual-stretch-jeans-casual-denim-trousers-for-men-straight-cut-i2059753503.html,0.29,47,17,China,2024-07-23 13:42:02.199729,59847.59,146523.41
320,ASRV quần jean quần,ASRV quần jean quần bò nam quần đũi dài pants jeans for men Quần jeans nam kiểu Mỹ cổ điển,207000,https://www.lazada.vn/products/asrv-quan-jean-quan-bo-nam-quan-dui-dai-pants-jeans-for-men-quan-jeans-nam-kieu-my-co-dien-i2357168314.html,0.5,57,59,,2024-07-23 13:42:02.199729,103500.0,103500.0
321,ASRV quần jean quần,ASRV quần jean quần bò nam quần đũi dài pants jeans for men Quần Denim Quần Ống Rộng Dáng Rộng Cho Nam Sành Điệu Và Quần Jean Mỏng,208000,https://www.lazada.vn/products/asrv-quan-jean-quan-bo-nam-quan-dui-dai-pants-jeans-for-men-quan-denim-quan-ong-rong-dang-rong-cho-nam-sanh-dieu-va-quan-jean-mong-i1824254652.html,0.5,33,91,,2024-07-23 13:42:02.199729,104000.0,104000.0
322,ASRV Quần Jean Nam,ASRV Quần Jean Nam Quần Bò Đường Phố Chiên Rán In Chữ Thập Phong Cách Mỹ Dáng Suông Rộng,209000,https://www.lazada.vn/products/asrv-quan-jean-nam-quan-bo-duong-pho-chien-ran-in-chu-thap-phong-cach-my-dang-suong-rong-i1856693658.html,0.5,136,202,Hồ Chí Minh,2024-07-23 13:42:02.199729,104500.0,104500.0
323,ASRV quần jean quần,ASRV quần jean quần bò nam quần đũi dài pants jeans for men Đẹp Trai Quần Jean Rách Người Đàn Ông Của Cổ Điển Tấm Đường vắt sổ lỏng Quần dáng đứng dáng rộng Bf Giản Dị Quần Legging rộng Daddy Quần,209000,https://www.lazada.vn/products/asrv-quan-jean-quan-bo-nam-quan-dui-dai-pants-jeans-for-men-dep-trai-quan-jean-rach-nguoi-dan-ong-cua-co-dien-tam-duong-vat-so-long-quan-dang-dung-dang-rong-bf-gian-di-quan-legging-rong-daddy-quan-i2347797025.html,0.5,189,128,,2024-07-23 13:42:02.199729,104500.0,104500.0
324,ASRV quần jean quần,ASRV quần jean quần bò nam quần đũi dài pants jeans for men Quần jean cạp cao kiểu hoài cổ ống suông dáng ôm cho nam quần ống rộng thiết kế kiểu Mỹ,209000,https://www.lazada.vn/products/asrv-quan-jean-quan-bo-nam-quan-dui-dai-pants-jeans-for-men-quan-jean-cap-cao-kieu-hoai-co-ong-suong-dang-om-cho-nam-quan-ong-rong-thiet-ke-kieu-my-i2444117620.html,0.5,31,23,,2024-07-23 13:42:02.199729,104500.0,104500.0
325,Nam Trang Bị Quần,Nam Trang Bị Quần Jean Co Giãn Cổ Điển Mùa Thu Phong Cách Doanh Nhân Cotton Denim Quần Ống Suông Giữa Eo Có Dây Kéo Bay Đen/xanh Dương,209100,https://www.lazada.vn/products/nam-trang-bi-quan-jean-co-gian-co-dien-mua-thu-phong-cach-doanh-nhan-cotton-denim-quan-ong-suong-giua-eo-co-day-keo-bay-denxanh-duong-i2562761933.html,0.23,167,17,China,2024-07-23 13:42:02.199729,48093.0,161007.0
326,ASRV quần jean quần,ASRV quần jean quần bò nam quần đũi dài pants jeans for men Quần quần thẳng nam Retro Quần jean rách cá tính cho nam,210000,https://www.lazada.vn/products/asrv-quan-jean-quan-bo-nam-quan-dui-dai-pants-jeans-for-men-quan-quan-thang-nam-retro-quan-jean-rach-ca-tinh-cho-nam-i2261592340.html,0.5,675,630,,2024-07-23 13:42:02.199729,105000.0,105000.0
327,ASRV quần jean quần,ASRV quần jean quần bò nam quần đũi dài pants jeans for men Quần Bò Kẻ Ca Rô Quần Ống Rộng Giặt Rộng Thương Hiệu Đường Phố Cao Cấp Thịnh Hành Phong Cách Instagram Cho Nam,210000,https://www.lazada.vn/products/asrv-quan-jean-quan-bo-nam-quan-dui-dai-pants-jeans-for-men-quan-bo-ke-ca-ro-quan-ong-rong-giat-rong-thuong-hieu-duong-pho-cao-cap-thinh-hanh-phong-cach-instagram-cho-nam-i1981452868.html,0.5,348,385,,2024-07-23 13:42:02.199729,105000.0,105000.0
328,ASRV quần jean quần,ASRV quần jean quần bò nam quần đũi dài pants jeans for men Quần Jean Nam Quần short denim graffiti cổ điển cho nam và nữ rộng mùa hè thường ngày quần ống rộng,212000,https://www.lazada.vn/products/asrv-quan-jean-quan-bo-nam-quan-dui-dai-pants-jeans-for-men-quan-jean-nam-quan-short-denim-graffiti-co-dien-cho-nam-va-nu-rong-mua-he-thuong-ngay-quan-ong-rong-i2407009457.html,0.5,177,258,,2024-07-23 13:42:02.199729,106000.0,106000.0
329,Nam Thu Đông Quần,Nam Thu Đông Quần Jean Slim Fit Thẳng Đáy Quần Quần Dài Cá Tính Chất Liệu Cotton Đa Năng Cho Thời Trang,212200,https://www.lazada.vn/products/nam-thu-dong-quan-jean-slim-fit-thang-day-quan-quan-dai-ca-tinh-chat-lieu-cotton-da-nang-cho-thoi-trang-i2616051765.html,0.23,0,2,,2024-07-23 13:42:02.199729,48806.0,163394.0
330,Nam Thu Đông Vintage,Nam Thu Đông Vintage Ghép Quần Jean Thường Hợp Thời Trang Dáng Rộng Co Giãn Quần Dài Cho Giải Trí,212200,https://www.lazada.vn/products/nam-thu-dong-vintage-ghep-quan-jean-thuong-hop-thoi-trang-dang-rong-co-gian-quan-dai-cho-giai-tri-i2631664557.html,0.17,73,25,Hà Nội,2024-07-23 13:42:02.199729,36074.0,176126.0
331,Hợp Thời Trang Nam,Hợp Thời Trang Nam Slim Fit Nhiều Túi Quần Giải Trí Phong Cách Thường Ngày Co Giãn Dài Vải Polyster Cá Tính Khối Màu Thiết Kế,212200,https://www.lazada.vn/products/hop-thoi-trang-nam-slim-fit-nhieu-tui-quan-giai-tri-phong-cach-thuong-ngay-co-gian-dai-vai-polyster-ca-tinh-khoi-mau-thiet-ke-i2615442882.html,0.23,23,10,China,2024-07-23 13:42:02.199729,48806.0,163394.0
332,YIPINYOUYOU丨Quần dài nam-Quần jeans,YIPINYOUYOU丨Quần dài nam-Quần jeans nam chắp vá cao cấp phong cách retro phong cách Mỹ phong cách cổ điển phong cách cổ điển kiểu Mỹ quần thẳng xếp nếp quần legging rộng cao,214000,https://www.lazada.vn/products/yipinyouyouquan-dai-nam-quan-jeans-nam-chap-va-cao-cap-phong-cach-retro-phong-cach-my-phong-cach-co-dien-phong-cach-co-dien-kieu-my-quan-thang-xep-nep-quan-legging-rong-cao-i2419956989.html,0.4,171,161,China,2024-07-23 13:42:02.199729,85600.0,128400.0
333,ASRV quần jean quần,ASRV quần jean quần bò nam quần đũi dài pants jeans for men Quần dài nam-Quần jeans nam chắp vá cao cấp phong cách retro phong cách Mỹ phong cách cổ điển phong cách cổ điển kiểu Mỹ quần thẳng xếp nếp quần legging rộng cao,214000,https://www.lazada.vn/products/asrv-quan-jean-quan-bo-nam-quan-dui-dai-pants-jeans-for-men-quan-dai-nam-quan-jeans-nam-chap-va-cao-cap-phong-cach-retro-phong-cach-my-phong-cach-co-dien-phong-cach-co-dien-kieu-my-quan-thang-xep-nep-quan-legging-rong-cao-i2424874406.html,0.5,362,299,,2024-07-23 13:42:02.199729,107000.0,107000.0
334,ASRV quần jean quần,ASRV quần jean quần bò nam quần đũi dài pants jeans for men Quần jeans cho nam Quần Túi Hộp ống đứng dáng ôm vừa vặn quần bootcut thương hiệu cao thời trang đường phố phong cách Mỹ,214000,https://www.lazada.vn/products/asrv-quan-jean-quan-bo-nam-quan-dui-dai-pants-jeans-for-men-quan-jeans-cho-nam-quan-tui-hop-ong-dung-dang-om-vua-van-quan-bootcut-thuong-hieu-cao-thoi-trang-duong-pho-phong-cach-my-i2473631149.html,0.5,79,93,Hong Kong,2024-07-23 13:42:02.199729,107000.0,107000.0
335,SUPEEON丨Quần dài nam-Quần jeans,SUPEEON丨Quần dài nam-Quần jeans nam chắp vá cao cấp phong cách retro phong cách Mỹ phong cách cổ điển phong cách cổ điển kiểu Mỹ quần thẳng xếp nếp quần legging rộng cao,214000,https://www.lazada.vn/products/supeeonquan-dai-nam-quan-jeans-nam-chap-va-cao-cap-phong-cach-retro-phong-cach-my-phong-cach-co-dien-phong-cach-co-dien-kieu-my-quan-thang-xep-nep-quan-legging-rong-cao-i2424307041.html,0.5,92,82,,2024-07-23 13:42:02.199729,107000.0,107000.0
336,KYUSHUAD Quần jeans nam,KYUSHUAD Quần jeans nam Đồ jEAN mới đường phố Mỹ cậu bé bộ quần ống đứng dáng rộng chân yếm cỡ lỡn Quần Harem thường ngày phong cách đẹp trai,216000,https://www.lazada.vn/products/kyushuad-quan-jeans-nam-do-jean-moi-duong-pho-my-cau-be-bo-quan-ong-dung-dang-rong-chan-yem-co-lon-quan-harem-thuong-ngay-phong-cach-dep-trai-i2615468203.html,0.38,10,13,Hồ Chí Minh,2024-07-23 13:42:02.199729,82080.0,133920.0
337,Quần jeans nam Đồ,Quần jeans nam Đồ jEAN mới thường ngày quần quần Harlan ống đứng dáng rộng đẹp trai thời trang giản dị,216000,https://www.lazada.vn/products/quan-jeans-nam-do-jean-moi-thuong-ngay-quan-quan-harlan-ong-dung-dang-rong-dep-trai-thoi-trang-gian-di-i2659100434.html,0.38,0,0,,2024-07-23 13:42:02.199729,82080.0,133920.0
338,Hợp Thời Trang Xốp,"Hợp Thời Trang Xốp In Quần Jean Nam Mùa Xuân, Mùa Thu 2024 Dáng Rộng Chân Thẳng Chuông Đáy Quần Phong Cách Mỹ",217500,https://www.lazada.vn/products/hop-thoi-trang-xop-in-quan-jean-nam-mua-xuan-mua-thu-2024-dang-rong-chan-thang-chuong-day-quan-phong-cach-my-i2664793532.html,0.23,0,0,,2024-07-23 13:42:02.199729,50025.0,167475.0
339,Semir Quần Jean Quần,Semir Quần Jean Quần Nam Ống Côn Dây Rút Xu Hướng Năng Động Thời Trang Mới 2024 Đơn Giản Hàng Ngày Quần jeans nam,218000,https://www.lazada.vn/products/semir-quan-jean-quan-nam-ong-con-day-rut-xu-huong-nang-dong-thoi-trang-moi-2024-don-gian-hang-ngay-quan-jeans-nam-i1986874268.html,0.44,58,25,Hà Nội,2024-07-23 13:42:02.199729,95920.0,122080.0
340,Nam Hợp Thời Trang,Nam Hợp Thời Trang Nhỏ Loe Quần Jean Co Giãn Ôm Vừa Vặn Dài Quần Phong Cách Hàn Quốc Chất Liệu Cotton Dành Cho Thanh Thiếu Niên,219000,https://www.lazada.vn/products/nam-hop-thoi-trang-nho-loe-quan-jean-co-gian-om-vua-van-dai-quan-phong-cach-han-quoc-chat-lieu-cotton-danh-cho-thanh-thieu-nien-i2665471851.html,0.23,0,0,,2024-07-23 13:42:02.199729,50370.0,168630.0
341,SUPEEON丨Quần jean Mỹ cổ,SUPEEON丨Quần jean Mỹ cổ điển nam thời trang thường ngày quần ống đứng Thiết kế bụi bặm cảm giác và quần linh hoạt,219000,https://www.lazada.vn/products/supeeonquan-jean-my-co-dien-nam-thoi-trang-thuong-ngay-quan-ong-dung-thiet-ke-bui-bam-cam-giac-va-quan-linh-hoat-i2474287042.html,0.5,72,55,,2024-07-23 13:42:02.199729,109500.0,109500.0
342,Quần jean nam túi,Quần jean nam túi kiểu kaki co giãn suông nhẹ đơn giản VNXK xịn,219000,https://www.lazada.vn/products/quan-jean-nam-tui-kieu-kaki-co-gian-suong-nhe-don-gian-vnxk-xin-i2419502819.html,0.0,0,0,,2024-07-23 13:42:02.199729,0.0,219000.0
343,ASRV quần jean quần,ASRV quần jean quần bò nam quần đũi dài pants jeans for men Quần bò có khóa kéo Quần Nam Cao đường phố cổ điển đau khổ quần ống đứng ỐNg RộNg,220000,https://www.lazada.vn/products/asrv-quan-jean-quan-bo-nam-quan-dui-dai-pants-jeans-for-men-quan-bo-co-khoa-keo-quan-nam-cao-duong-pho-co-dien-dau-kho-quan-ong-dung-ong-rong-i2518799735.html,0.5,72,77,Hồ Chí Minh,2024-07-23 13:42:02.199729,110000.0,110000.0
344,Năm 2023 Nam Dạo,Năm 2023 Nam Dạo Phố Quần Baggy Ống Rộng Quần Jean Thời Trang Hàn Quốc Drap Dáng Rộng Denim Hàng Hóa Quần Có Dây Kéo Bay Và túi,220400,https://www.lazada.vn/products/nam-2023-nam-dao-pho-quan-baggy-ong-rong-quan-jean-thoi-trang-han-quoc-drap-dang-rong-denim-hang-hoa-quan-co-day-keo-bay-va-tui-i2562801001.html,0.23,18,21,,2024-07-23 13:42:02.199729,50692.0,169708.0
345,Semir Jeans Nam Mùa,Semir Jeans Nam Mùa Hè Lỏng Lẻo Và Đơn Giản Hàng Ngày xu hướng thời trang thường ngày Tinh Khiết Cotton phong cách trường học quần tây thứ năm quần jeans ống loe,221088,https://www.lazada.vn/products/semir-jeans-nam-mua-he-long-leo-va-don-gian-hang-ngay-xu-huong-thoi-trang-thuong-ngay-tinh-khiet-cotton-phong-cach-truong-hoc-quan-tay-thu-nam-quan-jeans-ong-loe-i2281073145.html,0.5,195,38,,2024-07-23 13:42:02.199729,110544.0,110544.0
