id,Name,title,price,link_item,discount,sold,evaluate,location,timestamp,discount_value,final_price
485,Quần jean nam chất,Quần jean nam chất bò 3 cái trơn đẹp trung niên ống suông big size,325000,https://www.lazada.vn/products/quan-jean-nam-chat-bo-3-cai-tron-dep-trung-nien-ong-suong-big-size-i1271280057.html,0.35,627,235,Hồ Chí Minh,2024-07-23 13:42:02.199729,113750.0,211250.0
486,Quần jean nam chất,Quần jean nam chất bò 3 cái trơn đẹp ống suông trung niên big size,325000,https://www.lazada.vn/products/quan-jean-nam-chat-bo-3-cai-tron-dep-ong-suong-trung-nien-big-size-i1278157798.html,0.0,0,0,,2024-07-23 13:42:02.199729,0.0,325000.0
487,Nam Slim Fit Quần,"Nam Slim Fit Quần Jean Giữa Eo Co Giãn Ống Thẳng Denim Quần Mềm Mại Thoải Mái Mùa Xuân, Mùa Thu",326300,https://www.lazada.vn/products/nam-slim-fit-quan-jean-giua-eo-co-gian-ong-thang-denim-quan-mem-mai-thoai-mai-mua-xuan-mua-thu-i2661193978.html,0.23,0,0,Hà Nội,2024-07-23 13:42:02.199729,75049.0,251251.0
488,Nam Chân Thẳng Quần,Nam Chân Thẳng Quần Jean Thoải Mái Cotton Pha Phong Cách Doanh Nhân Bay Đóng Cửa Có Dây Kéo Thoải Mái Và Đa Năng,327600,https://www.lazada.vn/products/nam-chan-thang-quan-jean-thoai-mai-cotton-pha-phong-cach-doanh-nhan-bay-dong-cua-co-day-keo-thoai-mai-va-da-nang-i2625718381.html,0.23,0,0,,2024-07-23 13:42:02.199729,75348.0,252252.0
489,Nam Quần Nhung Mật,Nam Quần Nhung Mật Độ Cao Ấm Áp Hợp Thời Trang Cắt Bút Chì Chân Nhỏ Pha Trộn Bông Để Sử Dụng Hàng Ngày,327600,https://www.lazada.vn/products/nam-quan-nhung-mat-do-cao-am-ap-hop-thoi-trang-cat-but-chi-chan-nho-pha-tron-bong-de-su-dung-hang-ngay-i2625690018.html,0.23,0,0,,2024-07-23 13:42:02.199729,75348.0,252252.0
490,Quần Jean Nam Ice,Quần Jean Nam Ice Silk Ống Suông Quần Âu Cao Cấp Có Độ Đàn Hồi Cotton Xu Hướng Thời Trang Cao Cấp,327600,https://www.lazada.vn/products/quan-jean-nam-ice-silk-ong-suong-quan-au-cao-cap-co-do-dan-hoi-cotton-xu-huong-thoi-trang-cao-cap-i2631891248.html,0.17,0,0,Hồ Chí Minh,2024-07-23 13:42:02.199729,55692.00000000001,271908.0
491,"Quần short Jean BR,","Quần short Jean BR, Quần short nam jean BR Xám Đậm, Đen co giãn, mềm mịn, thoáng mát, thoải mái, sang trọng - Bravery",329000,https://www.lazada.vn/products/quan-short-jean-br-quan-short-nam-jean-br-xam-dam-den-co-gian-mem-min-thoang-mat-thoai-mai-sang-trong-bravery-i2175057827.html,0.21,36,13,Hồ Chí Minh,2024-07-23 13:42:02.199729,69090.0,259910.0
492,Nam Tencel Co Giãn,Nam Tencel Co Giãn Chân Thẳng Quần Jean Thường Ngày Trung Niên Bố Quần Mùa Thu Dáng Rộng Quần Dài,329000,https://www.lazada.vn/products/nam-tencel-co-gian-chan-thang-quan-jean-thuong-ngay-trung-nien-bo-quan-mua-thu-dang-rong-quan-dai-i2625610446.html,0.23,0,1,,2024-07-23 13:42:02.199729,75670.0,253330.0
493,Quần Jean Dài Nam,Quần Jean Dài Nam Yessir RURUMEN Quần Dài Jeans VNXK Cao Cấp - QB408,329000,https://www.lazada.vn/products/quan-jean-dai-nam-yessir-rurumen-quan-dai-jeans-vnxk-cao-cap-qb408-i2454111644.html,0.51,5,5,Hà Nội,2024-07-23 13:42:02.199729,167790.0,161210.0
494,Quần Jean Nam Đen,Quần Jean Nam Đen Xám Khói Hàng Hiệu Xuất Khẩu Slimfit co giãn Jean Gân xịn,329000,https://www.lazada.vn/products/quan-jean-nam-den-xam-khoi-hang-hieu-xuat-khau-slimfit-co-gian-jean-gan-xin-i1967427042.html,0.27,151,60,,2024-07-23 13:42:02.199729,88830.0,240170.0
495,Cao Cấp Slim Fit,Cao Cấp Slim Fit Quần Jean Nam Chân Thẳng Cổ Vintage Quần Dài Hợp Thời Trang Mùa Thu/Mùa Đông Dành Cho Nam Giới Trẻ Trơn Hình Bóng,331200,https://www.lazada.vn/products/cao-cap-slim-fit-quan-jean-nam-chan-thang-co-vintage-quan-dai-hop-thoi-trang-mua-thumua-dong-danh-cho-nam-gioi-tre-tron-hinh-bong-i2636737649.html,0.16,0,0,Hồ Chí Minh,2024-07-23 13:42:02.199729,52992.0,278208.0
496,Quần jean mềm hợp,Quần jean mềm hợp thời trang dành cho nam có độ đàn hồi cao Slim Fit thoáng khí Thoải mái chống mài mòn cho những cảnh thường ngày,332600,https://www.lazada.vn/products/quan-jean-mem-hop-thoi-trang-danh-cho-nam-co-do-dan-hoi-cao-slim-fit-thoang-khi-thoai-mai-chong-mai-mon-cho-nhung-canh-thuong-ngay-i2664639387.html,0.23,0,0,Hồ Chí Minh,2024-07-23 13:42:02.199729,76498.0,256102.0
497,Năm 2024 Nam Vintage,Năm 2024 Nam Vintage Chân Thẳng Quần Jean Cao Cấp Cổ Rủ Phong Cách Đa Năng Phù Hợp Với Tất Cả Các Loại Cơ Thể,332800,https://www.lazada.vn/products/nam-2024-nam-vintage-chan-thang-quan-jean-cao-cap-co-ru-phong-cach-da-nang-phu-hop-voi-tat-ca-cac-loai-co-the-i2625615467.html,0.23,0,0,,2024-07-23 13:42:02.199729,76544.0,256256.0
498,Nam Cao Cấp Bốn,Nam Cao Cấp Bốn Mùa Thẳng Xi Lanh Quần Jean Co Giãn Đa Năng Áo Cotton Thời Trang Người Lớn,334100,https://www.lazada.vn/products/nam-cao-cap-bon-mua-thang-xi-lanh-quan-jean-co-gian-da-nang-ao-cotton-thoi-trang-nguoi-lon-i2625609871.html,0.23,0,0,Hồ Chí Minh,2024-07-23 13:42:02.199729,76843.0,257257.0
499,Nam Vintage Thiết Kế,Nam Vintage Thiết Kế Ngôi Sao Quần Jean Dáng Rộng Ống Thẳng Quần Denim Dạo Phố Cao Cấp Phong Cách Thường Ngày Ghép Hốc Thời Trang Hợp Thời Trang,334700,https://www.lazada.vn/products/nam-vintage-thiet-ke-ngoi-sao-quan-jean-dang-rong-ong-thang-quan-denim-dao-pho-cao-cap-phong-cach-thuong-ngay-ghep-hoc-thoi-trang-hop-thoi-trang-i2632092257.html,0.17,0,0,,2024-07-23 13:42:02.199729,56899.00000000001,277801.0
500,Houzhou Quần Jean Baggy,Houzhou Quần Jean Baggy Nam Đen Quần Ống Rộng Oversize Hàng Hóa Hàn Quốc Dạo Phố Hip Hop Phong Cách Harajuku Denim Quần Có Túi,336100,https://www.lazada.vn/products/houzhou-quan-jean-baggy-nam-den-quan-ong-rong-oversize-hang-hoa-han-quoc-dao-pho-hip-hop-phong-cach-harajuku-denim-quan-co-tui-i2581808729.html,0.23,10,0,,2024-07-23 13:42:02.199729,77303.0,258797.0
501,Semir Quần Jean Nam,Semir Quần Jean Nam Quần Bút Chì Ôm Co Giãn Lycra Mỏng Mùa Xuân Và Mùa Thu Quần Denim Cổ Điển Cho Nam 2022,337000,https://www.lazada.vn/products/semir-quan-jean-nam-quan-but-chi-om-co-gian-lycra-mong-mua-xuan-va-mua-thu-quan-denim-co-dien-cho-nam-2022-i1968534699.html,0.3,190,76,Đà Nẵng,2024-07-23 13:42:02.199729,101100.0,235900.0
502,Retro Quần Jean Nam,Retro Quần Jean Nam Màu Xanh Đơn Giản Thu Đông Thời Trang Nhỏ Thẳng Trụ Quần Cá Tính Thời Trang,337900,https://www.lazada.vn/products/retro-quan-jean-nam-mau-xanh-don-gian-thu-dong-thoi-trang-nho-thang-tru-quan-ca-tinh-thoi-trang-i2625773519.html,0.23,0,0,,2024-07-23 13:42:02.199729,77717.0,260183.0
503,[Hết Size Xả Kho],[Hết Size Xả Kho] Thương Hiệu Pierre Cardin Quần Bò Nam Mẫu Mới Mùa Thu Đông Năm 2023 Giá Thanh Lý 58 Tệ,338000,https://www.lazada.vn/products/het-size-xa-kho-thuong-hieu-pierre-cardin-quan-bo-nam-mau-moi-mua-thu-dong-nam-2023-gia-thanh-ly-58-te-i2499505882.html,0.52,21,12,,2024-07-23 13:42:02.199729,175760.0,162240.0
504,Semir Quần Jean Cổ,Semir Quần Jean Cổ Điển Cho Nam Quần Mùa Xuân Thời Trang Đường Phố Cho Bé Trai Đi Làm Quần Thoải Mái,338682,https://www.lazada.vn/products/semir-quan-jean-co-dien-cho-nam-quan-mua-xuan-thoi-trang-duong-pho-cho-be-trai-di-lam-quan-thoai-mai-i2194338277.html,0.49,44,19,China,2024-07-23 13:42:02.199729,165954.18,172727.82
505,Semir Jeans Nam rộng,Semir Jeans Nam rộng mùa đông thời trang cổ điển mới phong cách đường phố quần bó sát quần bò ống loe,338682,https://www.lazada.vn/products/semir-jeans-nam-rong-mua-dong-thoi-trang-co-dien-moi-phong-cach-duong-pho-quan-bo-sat-quan-bo-ong-loe-i2427767716.html,0.49,11,7,,2024-07-23 13:42:02.199729,165954.18,172727.82
506,ASRV quần jean quần,ASRV quần jean quần bò nam quần đũi dài pants jeans for men Quần Yếm Denim thêu chữ Retro đường phố phong cách Ins thường ngày nam và nữ quần jean rộng dễ phối,339000,https://www.lazada.vn/products/asrv-quan-jean-quan-bo-nam-quan-dui-dai-pants-jeans-for-men-quan-yem-denim-theu-chu-retro-duong-pho-phong-cach-ins-thuong-ngay-nam-va-nu-quan-jean-rong-de-phoi-i2346234377.html,0.5,233,275,,2024-07-23 13:42:02.199729,169500.0,169500.0
507,Quần jeans quần bò,Quần jeans quần bò thụng túi chéo trung niên cao cấp,339000,https://www.lazada.vn/products/quan-jeans-quan-bo-thung-tui-cheo-trung-nien-cao-cap-i2168468188.html,0.46,58,19,,2024-07-23 13:42:02.199729,155940.0,183060.0
508,Quần Jean Nam Ống,Quần Jean Nam Ống Suông Dáng Rộng Mùa Hè Thường Ngày Hợp Thời Trang Thương Hiệu Ống Rộng Phong Cách Hồng Kông Quần Dài,340100,https://www.lazada.vn/products/quan-jean-nam-ong-suong-dang-rong-mua-he-thuong-ngay-hop-thoi-trang-thuong-hieu-ong-rong-phong-cach-hong-kong-quan-dai-i2661510864.html,0.23,0,0,Hồ Chí Minh,2024-07-23 13:42:02.199729,78223.0,261877.0
509,Quần Jean Baggy Nam,Quần Jean Baggy Nam Phong Cách Hip Hop Mỹ Hợp Thời Trang Thương Hiệu Nối Miếng Dán Rách Phá Hủy Vagabond Quần Thời Trang,341700,https://www.lazada.vn/products/quan-jean-baggy-nam-phong-cach-hip-hop-my-hop-thoi-trang-thuong-hieu-noi-mieng-dan-rach-pha-huy-vagabond-quan-thoi-trang-i2661741484.html,0.23,0,0,Hồ Chí Minh,2024-07-23 13:42:02.199729,78591.0,263109.0
510,Nam Cao Cấp Trung,Nam Cao Cấp Trung Niên Công Sở Quần Jean Nhẹ Thoáng Khí Quần Ống Suông Lyocell Co Giãn Chống Nhăn Quần Âu,343000,https://www.lazada.vn/products/nam-cao-cap-trung-nien-cong-so-quan-jean-nhe-thoang-khi-quan-ong-suong-lyocell-co-gian-chong-nhan-quan-au-i2631915401.html,0.17,0,0,,2024-07-23 13:42:02.199729,58310.00000000001,284690.0
511,Semir jeans người đàn,Semir jeans người đàn ông 2024 mùa đông mới lỏng phong cách đường phố thời trang quần thon quần yếm,344000,https://www.lazada.vn/products/semir-jeans-nguoi-dan-ong-2024-mua-dong-moi-long-phong-cach-duong-pho-thoi-trang-quan-thon-quan-yem-i2427781278.html,0.44,23,10,China,2024-07-23 13:42:02.199729,151360.0,192640.0
512,Quần Jean Nam H90,Quần Jean Nam H90 Quần Jean Ống Rộng Unisex Chất Bò Không Co Giãn Cao Cấp Chống Nhăn Không Phai Màu HTRJ013,345000,https://www.lazada.vn/products/quan-jean-nam-h90-quan-jean-ong-rong-unisex-chat-bo-khong-co-gian-cao-cap-chong-nhan-khong-phai-mau-htrj013-i2041372505.html,0.0,15,375,Hồ Chí Minh,2024-07-23 13:42:02.199729,0.0,345000.0
513,Áo dài nam cách,Áo dài nam cách tân Chaang May sẵn vải gấm da be nâu dày dặn lên form Vestton dự tiệc biểu diễn lễ tết đẹp ADC133,345000,https://www.lazada.vn/products/ao-dai-nam-cach-tan-chaang-may-san-vai-gam-da-be-nau-day-dan-len-form-vestton-du-tiec-bieu-dien-le-tet-dep-adc133-i1508754367.html,0.41,250,52,Hồ Chí Minh,2024-07-23 13:42:02.199729,141450.0,203550.0
514,Quần Jean Nam Ống,Quần Jean Nam Ống Suông Mùa Thu Phong Cách Doanh Nhân Cao Cấp Màu Trơn Mềm Mại Thoải Mái Trung Niên Quần Nam Trẻ Trung,348200,https://www.lazada.vn/products/quan-jean-nam-ong-suong-mua-thu-phong-cach-doanh-nhan-cao-cap-mau-tron-mem-mai-thoai-mai-trung-nien-quan-nam-tre-trung-i2625597730.html,0.23,0,1,Hồ Chí Minh,2024-07-23 13:42:02.199729,80086.0,268114.0
515,Nam Bắc Ấm Áp,Nam Bắc Ấm Áp Trang Jeans Không Chất Nhờn Phù Hợp Với Thêu Quần Dài Dày Đa Năng Nhỏ Thẳng Trụ Quần,348200,https://www.lazada.vn/products/nam-bac-am-ap-trang-jeans-khong-chat-nhon-phu-hop-voi-theu-quan-dai-day-da-nang-nho-thang-tru-quan-i2625626928.html,0.23,0,0,,2024-07-23 13:42:02.199729,80086.0,268114.0
516,Quần Jean Nam Co,"Quần Jean Nam Co Giãn Tốt GrayHomme cao cấp, Quần Bò Nam Phom Ôm, ống côn, Slimfit, Trẻ Trung, Thanh Lịch BJ039-PRO",349000,https://www.lazada.vn/products/quan-jean-nam-co-gian-tot-grayhomme-cao-cap-quan-bo-nam-phom-om-ong-con-slimfit-tre-trung-thanh-lich-bj039-pro-i2181662495.html,0.36,38,13,,2024-07-23 13:42:02.199729,125640.0,223360.0
517,Quần Bò Quần Dài,Quần Bò Quần Dài Thường Ngày Đàn Hồi Trào Lưu Mẫu Mới 2024 Mẫu Mỏng Mùa Xuân Hè Thương Hiệu Sành Điệu Ống Đứng Dáng Suông Cho Nam,349000,https://www.lazada.vn/products/quan-bo-quan-dai-thuong-ngay-dan-hoi-trao-luu-mau-moi-2024-mau-mong-mua-xuan-he-thuong-hieu-sanh-dieu-ong-dung-dang-suong-cho-nam-i1331618248.html,0.68,25,9,Hồ Chí Minh,2024-07-23 13:42:02.199729,237320.00000000003,111679.99999999997
518,Quần Jean Nam Dài,"Quần Jean Nam Dài Cao Cấp FUJIWA - 511M. Ống Đứng Không Ôm. Gấu Được May Lai. Size 29, 30, 31, 32, 34 (52kg - 84k)",349000,https://www.lazada.vn/products/quan-jean-nam-dai-cao-cap-fujiwa-511m-ong-dung-khong-om-gau-duoc-may-lai-size-29-30-31-32-34-52kg-84k-i2018121362.html,0.48,91,21,Hồ Chí Minh,2024-07-23 13:42:02.199729,167520.0,181480.0
519,Nam Mùa Hè Quần,Nam Mùa Hè Quần Jean Lụa Mỏng Trong 3 Màu Full Bao Phủ Edge Dáng Rộng Ống Rộng Dài Quần Miễn Phí vận Chuyển,349300,https://www.lazada.vn/products/nam-mua-he-quan-jean-lua-mong-trong-3-mau-full-bao-phu-edge-dang-rong-ong-rong-dai-quan-mien-phi-van-chuyen-i2661782095.html,0.23,0,0,Hồ Chí Minh,2024-07-23 13:42:02.199729,80339.0,268961.0
520,Semir denim chiều dài,Semir denim chiều dài trung bình nam mùa hè Elastico eo baggies thời trang cổ điển Retro rửa quần ống đứng quần jean nam big size,350000,https://www.lazada.vn/products/semir-denim-chieu-dai-trung-binh-nam-mua-he-elastico-eo-baggies-thoi-trang-co-dien-retro-rua-quan-ong-dung-quan-jean-nam-big-size-i2589297082.html,0.26,333,65,China,2024-07-23 13:42:02.199729,91000.0,259000.0
521,Năm 2024 Nam Nữ,Năm 2024 Nam Nữ Dáng Rộng Chân Thẳng Vintage Quần Jean Phong Cách Mỹ Thiết Kế Đường Phố Nhạy Cảm Ống Rộng Quần Công Sở,350400,https://www.lazada.vn/products/nam-2024-nam-nu-dang-rong-chan-thang-vintage-quan-jean-phong-cach-my-thiet-ke-duong-pho-nhay-cam-ong-rong-quan-cong-so-i2662515088.html,0.23,0,0,Hồ Chí Minh,2024-07-23 13:42:02.199729,80592.0,269808.0
522,Quần Bò Chất Lượng,Quần Bò Chất Lượng Cao Quần Bò Nam Dáng Ôm Mới Quần Bò Thường Ngày Cho Nam Ống Đứng,351000,https://www.lazada.vn/products/quan-bo-chat-luong-cao-quan-bo-nam-dang-om-moi-quan-bo-thuong-ngay-cho-nam-ong-dung-i1867517880.html,0.6,30,10,,2024-07-23 13:42:02.199729,210600.0,140400.0
523,Semir Quần Jean Nam,Semir Quần Jean Nam 2024 Mùa Hè Mới Ngầu Cảm Giác Kháng Khuẩn Hàng Ngày Đơn Giản Xu Hướng Thời Trang Thường Ngày Quần Tây Thứ Năm yếm jean nam,354155,https://www.lazada.vn/products/semir-quan-jean-nam-2024-mua-he-moi-ngau-cam-giac-khang-khuan-hang-ngay-don-gian-xu-huong-thoi-trang-thuong-ngay-quan-tay-thu-nam-yem-jean-nam-i2236848862.html,0.48,7,7,Hồ Chí Minh,2024-07-23 13:42:02.199729,169994.4,184160.6
524,Quần Jean Nam Ống,Quần Jean Nam Ống Suông Ống Rộng Quần Âu Hợp Thời Trang Mùa Hè Mỏng Nichedesign Ống Rộng Đau Khổ Quần Ống Suông,355100,https://www.lazada.vn/products/quan-jean-nam-ong-suong-ong-rong-quan-au-hop-thoi-trang-mua-he-mong-nichedesign-ong-rong-dau-kho-quan-ong-suong-i2666364462.html,0.23,0,0,Hà Nội,2024-07-23 13:42:02.199729,81673.0,273427.0
525,2023 Hợp Thời Trang,2023 Hợp Thời Trang Phong Cách Cặp Đôi Quần Jean Chất Liệu Cotton Nhiều Túi Chân Thẳng Dáng Rộng Quần Âu Cho Quần Áo Bảo Hộ Lao Động,355500,https://www.lazada.vn/products/2023-hop-thoi-trang-phong-cach-cap-doi-quan-jean-chat-lieu-cotton-nhieu-tui-chan-thang-dang-rong-quan-au-cho-quan-ao-bao-ho-lao-dong-i2660931836.html,0.23,0,0,,2024-07-23 13:42:02.199729,81765.0,273735.0
526,Thời Trang Cotton Màu,Thời Trang Cotton Màu Quần Jean Thêu 3D Tập Ánh Sáng Sang Trọng Co Giãn Mềm Mại Chống Nhăn Chân Thẳng Quần Denim,355500,https://www.lazada.vn/products/thoi-trang-cotton-mau-quan-jean-theu-3d-tap-anh-sang-sang-trong-co-gian-mem-mai-chong-nhan-chan-thang-quan-denim-i2661175806.html,0.0,0,0,,2024-07-23 13:42:02.199729,0.0,355500.0
527,Năm 2024 Nam Cổ,Năm 2024 Nam Cổ Điển Quần Jean Ống Rộng Năm Túi Đơn Giản Thoải Mái Quần Âu Dáng Rộng Đa Năng Cho Tất Cả Các Mùa,358000,https://www.lazada.vn/products/nam-2024-nam-co-dien-quan-jean-ong-rong-nam-tui-don-gian-thoai-mai-quan-au-dang-rong-da-nang-cho-tat-ca-cac-mua-i2661069790.html,0.23,0,0,,2024-07-23 13:42:02.199729,82340.0,275660.0
528,Quần jeans nam Mixed89,Quần jeans nam Mixed89 Vải Jeans cao cấp ống côn co giãn nhẹ thoải mái giữ dáng tốt phong cách Hàn Quốc,359000,https://www.lazada.vn/products/quan-jeans-nam-mixed89-vai-jeans-cao-cap-ong-con-co-gian-nhe-thoai-mai-giu-dang-tot-phong-cach-han-quoc-i2503287759.html,0.35,140,31,Hồ Chí Minh,2024-07-23 13:42:02.199729,125649.99999999999,233350.0
529,Davidso Người Đàn Ông,Davidso Người Đàn Ông Của Jeans Mùa Thu Kinh Doanh Thẳng Căng Jeans Giản Dị Thùng Thẳng Quần 28-40,360000,https://www.lazada.vn/products/davidso-nguoi-dan-ong-cua-jeans-mua-thu-kinh-doanh-thang-cang-jeans-gian-di-thung-thang-quan-28-40-i1990554103.html,0.59,6,2,,2024-07-23 13:42:02.199729,212400.0,147600.0
530,bigsize - quần jean,bigsize - quần jean nam bigsize màu đen trơn form limfit 80kg - 130kg,360000,https://www.lazada.vn/products/bigsize-quan-jean-nam-bigsize-mau-den-tron-form-limfit-80kg-130kg-i921406479.html,0.0,100,24,,2024-07-23 13:42:02.199729,0.0,360000.0
531,Nam Vintage Dáng Rộng,Nam Vintage Dáng Rộng Quần Jean Ống Thẳng Thiết Kế Thích Hợp Độ Nhạy Quần Dài Mặt Đất Có Dây Kéo Khe Bên Hông Cho Mùa Xuân,360600,https://www.lazada.vn/products/nam-vintage-dang-rong-quan-jean-ong-thang-thiet-ke-thich-hop-do-nhay-quan-dai-mat-dat-co-day-keo-khe-ben-hong-cho-mua-xuan-i2661549580.html,0.23,0,0,China,2024-07-23 13:42:02.199729,82938.0,277662.0
532,Quần Jean Nam Chân,Quần Jean Nam Chân Thẳng Vừa Vặn Thoáng Khí Băng Lụa Hợp Thời Trang Dài Quần Thu/Hè Nam,360600,https://www.lazada.vn/products/quan-jean-nam-chan-thang-vua-van-thoang-khi-bang-lua-hop-thoi-trang-dai-quan-thuhe-nam-i2661293234.html,0.23,0,0,,2024-07-23 13:42:02.199729,82938.0,277662.0
533,Quần Bò In Hoa,Quần Bò In Hoa Chữ Cái Cá Tính Màu Trắng Cho Nam Sành Điệu Quần Dài Tôn Dáng Ống Đứng Nhỏ Co Giãn Thanh Niên Quần Hoa Hộp Đêm,363000,https://www.lazada.vn/products/quan-bo-in-hoa-chu-cai-ca-tinh-mau-trang-cho-nam-sanh-dieu-quan-dai-ton-dang-ong-dung-nho-co-gian-thanh-nien-quan-hoa-hop-dem-i239073642.html,0.56,80,19,,2024-07-23 13:42:02.199729,203280.00000000003,159719.99999999997
534,Quần Jean Nam Ống,Quần Jean Nam Ống Đứng H90 Dáng Regular Form Rộng Rãi Thoải Mái Chất Bò Co Giãn MTRJ005,365000,https://www.lazada.vn/products/quan-jean-nam-ong-dung-h90-dang-regular-form-rong-rai-thoai-mai-chat-bo-co-gian-mtrj005-i2041803293.html,0.35,328,87,Hà Nội,2024-07-23 13:42:02.199729,127749.99999999999,237250.0
535,Quần Jean Nam H90,Quần Jean Nam H90 Ống Đứng Túi Chéo Chất Bò Co Giãn From Rộng Thoải Mái Không Bai Gião MTRJ004,365000,https://www.lazada.vn/products/quan-jean-nam-h90-ong-dung-tui-cheo-chat-bo-co-gian-from-rong-thoai-mai-khong-bai-giao-mtrj004-i2041530917.html,0.35,405,120,Hà Nội,2024-07-23 13:42:02.199729,127749.99999999999,237250.0
536,2024 Thu Đông Quần,2024 Thu Đông Quần Jean Nam Dáng Rộng Chân Thẳng Cổ Cảnh 1 Thay Thế Miễn Phí Vận Chuyển,365400,https://www.lazada.vn/products/2024-thu-dong-quan-jean-nam-dang-rong-chan-thang-co-canh-1-thay-the-mien-phi-van-chuyen-i2677730205.html,0.23,0,0,,2024-07-23 13:42:02.199729,84042.0,281358.0
537,Xuân Hè 2024 Nam,Xuân Hè 2024 Nam Ngụy Trang Hàng Hóa Quần Phong Cách Dạo Phố Cao Cấp Lưng Thun Chân Thẳng Dáng Rộng Thường Ngày,365700,https://www.lazada.vn/products/xuan-he-2024-nam-nguy-trang-hang-hoa-quan-phong-cach-dao-pho-cao-cap-lung-thun-chan-thang-dang-rong-thuong-ngay-i2661243743.html,0.23,0,0,,2024-07-23 13:42:02.199729,84111.0,281589.0
538,Vintage Chân Thẳng Tre,Vintage Chân Thẳng Tre Nút Uốn Cong Dao Micro Loe Quần Jean Nam Nữ Xuân Hè Sạch Sẽ hợp Thời Trang Thương Hiệu Quần,367800,https://www.lazada.vn/products/vintage-chan-thang-tre-nut-uon-cong-dao-micro-loe-quan-jean-nam-nu-xuan-he-sach-se-hop-thoi-trang-thuong-hieu-quan-i2661004857.html,0.23,0,0,,2024-07-23 13:42:02.199729,84594.0,283206.0
539,Semir Quần Jean Nam,Semir Quần Jean Nam Quần Rách Mài Ống Côn Vừa Vặn Xu Hướng Retro Cổ Điển Mới Mùa Hè 2022 Cho Nam,368000,https://www.lazada.vn/products/semir-quan-jean-nam-quan-rach-mai-ong-con-vua-van-xu-huong-retro-co-dien-moi-mua-he-2022-cho-nam-i1871673996.html,0.4,24,6,China,2024-07-23 13:42:02.199729,147200.0,220800.0
540,Mùa Hè 2024 Quần,Mùa Hè 2024 Quần Jean Nam Thêu In Co Giãn Ôm Vừa Vặn Quần Ống Suông Phong Cách Hàn Quốc Đeo Thường Ngày,368700,https://www.lazada.vn/products/mua-he-2024-quan-jean-nam-theu-in-co-gian-om-vua-van-quan-ong-suong-phong-cach-han-quoc-deo-thuong-ngay-i2664746509.html,0.23,0,0,Hồ Chí Minh,2024-07-23 13:42:02.199729,84801.0,283899.0
541,quần dài jean nam,"quần dài jean nam big size dành cho người mập, người béo bụng bự, quần jean nam big size",369000,https://www.lazada.vn/products/quan-dai-jean-nam-big-size-danh-cho-nguoi-map-nguoi-beo-bung-bu-quan-jean-nam-big-size-i1306232766.html,0.38,68,23,,2024-07-23 13:42:02.199729,140220.0,228780.0
542,Quần bò ống suông,Quần bò ống suông dáng ôm thanh niên nam 2023 xuân thu đơn giản thời trang nam phù hợp với bông co giãn quần bò denim hoài cổ,370000,https://www.lazada.vn/products/quan-bo-ong-suong-dang-om-thanh-nien-nam-2023-xuan-thu-don-gian-thoi-trang-nam-phu-hop-voi-bong-co-gian-quan-bo-denim-hoai-co-i2307603670.html,0.6,93,22,China,2024-07-23 13:42:02.199729,222000.0,148000.0
543,Quần Kaki Jean Màu,"Quần Kaki Jean Màu Rêu bơ DKA, Quần kaki nam dáng ôm đứng, Chất vải co giãn thoáng mát, Lịch sự trẻ trung - DOKI",370000,https://www.lazada.vn/products/quan-kaki-jean-mau-reu-bo-dka-quan-kaki-nam-dang-om-dung-chat-vai-co-gian-thoang-mat-lich-su-tre-trung-doki-i396524174.html,0.35,314,118,Hà Nội,2024-07-23 13:42:02.199729,129499.99999999999,240500.0
544,Quần Kaki Jean Cao,"Quần Kaki Jean Cao Cấp Đen DKA-01 Quần Kaki Nam dáng Ôm Nhẹ, ống 16-17 cm, Chất vải co giãn dầy dặn, Trẻ trung, Sành điệu - DOKI",370000,https://www.lazada.vn/products/quan-kaki-jean-cao-cap-den-dka-01-quan-kaki-nam-dang-om-nhe-ong-16-17-cm-chat-vai-co-gian-day-dan-tre-trung-sanh-dieu-doki-i878072149.html,0.0,0,0,,2024-07-23 13:42:02.199729,0.0,370000.0
545,Quần Jean Co Giãn,Quần Jean Co Giãn Nam Nhung Phong Cách Doanh Nhân Thiết Kế Hình Trụ Thẳng Thích Hợp Cho Người Trung Niên Và Người Cao Tuổi,370100,https://www.lazada.vn/products/quan-jean-co-gian-nam-nhung-phong-cach-doanh-nhan-thiet-ke-hinh-tru-thang-thich-hop-cho-nguoi-trung-nien-va-nguoi-cao-tuoi-i2625670268.html,0.23,0,0,Nước ngoài,2024-07-23 13:42:02.199729,85123.0,284977.0
546,Quần Jeans Nam Lưng,Quần Jeans Nam Lưng Thun Dáng Rộng Công Sở Ống Thẳng Quần Dài Mới 2023 Phong Cách Mùa Hè,370900,https://www.lazada.vn/products/quan-jeans-nam-lung-thun-dang-rong-cong-so-ong-thang-quan-dai-moi-2023-phong-cach-mua-he-i2661352188.html,0.23,0,0,,2024-07-23 13:42:02.199729,85307.0,285593.0
547,Laisheer Quần Jean Nam,Laisheer Quần Jean Nam Dáng Rộng Ice Silk Mỏng Mùa Hè Quần Tây Ống Rộng Thiết Kế Chân Thẳng Cao Cấp Phong Cách Đường Phố,370900,https://www.lazada.vn/products/laisheer-quan-jean-nam-dang-rong-ice-silk-mong-mua-he-quan-tay-ong-rong-thiet-ke-chan-thang-cao-cap-phong-cach-duong-pho-i2661107188.html,0.23,0,0,Hà Nội,2024-07-23 13:42:02.199729,85307.0,285593.0
548,Nam Vintage Quần Jean,Nam Vintage Quần Jean Vàng Cotton Co Giãn Phong Cách Doanh Nhân Nhẹ Thời Trang Mùa Hè Với Miễn Phí Vận Chuyển,372400,https://www.lazada.vn/products/nam-vintage-quan-jean-vang-cotton-co-gian-phong-cach-doanh-nhan-nhe-thoi-trang-mua-he-voi-mien-phi-van-chuyen-i2662466166.html,0.23,0,0,,2024-07-23 13:42:02.199729,85652.0,286748.0
549,Nam Dây Buộc Quần,Nam Dây Buộc Quần Jean Dáng Rộng Cổ Quần Co Giãn Mùa Hè Mỏng Phong Cách Ống Thẳng Quần Miễn Phí Vận Chuyển,372400,https://www.lazada.vn/products/nam-day-buoc-quan-jean-dang-rong-co-quan-co-gian-mua-he-mong-phong-cach-ong-thang-quan-mien-phi-van-chuyen-i2661310659.html,0.23,0,0,China,2024-07-23 13:42:02.199729,85652.0,286748.0
550,Quần Jean Dày Thu,"Quần Jean Dày Thu Đông Quần Dài Nam Thường Ngày Cỡ Lớn Cạp Cao Co Giãn Thẳng Dáng Rộng Soot, Nam",375795,https://www.lazada.vn/products/quan-jean-day-thu-dong-quan-dai-nam-thuong-ngay-co-lon-cap-cao-co-gian-thang-dang-rong-soot-nam-i907316013.html,0.39,146,28,,2024-07-23 13:42:02.199729,146560.05000000002,229234.94999999998
551,1970 Retro Quần Jean,1970 Retro Quần Jean Nam Giày Lười Phù Hợp Với Phong Cách Thu Đông Giải Trí Quần Chân Nhỏ Thương Hiệu Thời Trang Quần,376100,https://www.lazada.vn/products/1970-retro-quan-jean-nam-giay-luoi-phu-hop-voi-phong-cach-thu-dong-giai-tri-quan-chan-nho-thuong-hieu-thoi-trang-quan-i2625718685.html,0.16,0,0,,2024-07-23 13:42:02.199729,60176.0,315924.0
